,Unnamed: 0,jsonid,label,headline_text,subject,speaker,speakerjobtitle,stateinfo,partyaffiliation,barelytruecounts,falsecounts,halftruecounts,mostlytrueocunts,pantsonfirecounts,context,twitter_handle,followers
153,153,2869.json,half-true,We (Democrats) have made steady progress creating jobs and improving our schools.,"education,government-efficiency,job-accomplishments,jobs",armond-budish,Minority leader in the Ohio House of Representatives,Ohio,democrat,0,1,2,3,0,a news release,ArmondBudish,1846.0
154,154,3864.json,pants-fire,Michigan and Massachusetts raised their bottle deposit and could no longer afford the program because the redemptions were so high there was no profit in there.,environment,jeff-kruse,state senator,Oregon,republican,0,0,1,0,2,on the Oregon Senate floor,JeffKruse303,24.0
155,155,3054.json,TRUE,"Whether you like to admit it or not, half our general revenue goes to education.","education,state-budget",mike-haridopolos,Florida Senate President,Florida,republican,0,3,1,1,0,comments to reporters.,MikeHaridopolos,6076.0
156,156,2367.json,FALSE,Im the only one whos fought against developers draining the Everglades!,"environment,message-machine",kendrick-meek,,Florida,democrat,2,6,1,4,1,a television ad,KendrickMeek,6665.0
160,160,4453.json,barely-true,The jobs bill includes President Obamas tax on soup kitchens,"economy,jobs,taxes,workers",eric-cantor,House Majority Leader,Virginia,republican,9,6,4,4,4,a blog post,EricCantor,279310.0
161,161,6898.json,barely-true,Says the Obama administration spent taxpayer dollars on electric cars in Finland (and) windmills in China.,stimulus,paul-ryan,U.S. Representative,Wisconsin,republican,19,6,16,14,2,the vice-presidential debate,SpeakerRyan,3647633.0
164,164,11828.json,FALSE,We have more illegal immigrants here than we did five years ago.,immigration,marco-rubio,U.S. Senator,Florida,republican,33,24,32,35,5,"an interview on NBC's ""Meet the Press""",marcorubio,3872340.0
165,165,4504.json,barely-true,Says Rick Perry wrote a letter supporting Hillarycare.,health-care,ron-paul,U.S. representative,Texas,republican,5,8,8,8,3,a presidential debate,RonPaul,642429.0
167,167,1441.json,pants-fire,"The presidents health care proposals will cause most Americans to have their premiums increased, not decreased, and hundreds of millions of people lose their current insurance coverage.","health-care,pundits",nancy-pfotenhauer,political strategist,,republican,0,0,0,0,1,an interview on CNN,NPfotenhauer,131.0
169,169,7295.json,half-true,Says Chris Christie vetoed a jobs package of 30 bills.,jobs,stephen-sweeney,State Senator,,democrat,1,2,3,1,0,a radio interview,StephenSweens10,430.0
170,170,9554.json,TRUE,There are already more American jobs in the solar industry than in coal mining.,"climate-change,energy,environment,jobs",sheldon-whitehouse,U.S. Senator,Rhode Island,democrat,2,3,2,7,0,a newspaper commentary,SenWhitehouse,318872.0
171,171,2576.json,half-true,Says Illinois gubernatorial candidate Bill Bradys first priority after winning the primary was to sponsor a bill that would mass-euthanize sheltered dogs and cats in gas chambers.,"agriculture,job-accomplishments,message-machine",pat-quinn,Governor,Illinois,democrat,0,0,1,0,1,a campaign commercial,PQuinnfortheWin,2579.0
172,172,2954.json,half-true,Barack Obama is in an economy thats only worsened since hes been president of the United States.,"bankruptcy,economy,history,housing,income,job-accomplishments,pundits,abc-news-week,workers",matthew-dowd,Commentator,Texas,independent,0,0,2,4,0,"an interview on ABC's ""This Week with Christiane Amanpour""",matthewjdowd,137651.0
173,173,81.json,mostly-true,"Romney failed to take action against ""sanctuary cities"" in Massachusetts.",immigration,rudy-giuliani,Attorney,New York,republican,9,11,10,7,3,"St. Petersburg, Fla.",RudyGiuliani,296687.0
175,175,10142.json,FALSE,Says Thomas Eric Duncan came into the United States with an elevated temperature.,"ebola,health-care,public-health,transportation",darrell-issa,U.S. House of Representatives,California,republican,0,3,0,0,0,"comments on CNN's ""State of the Union""",DarrellIssa,298941.0
179,179,4681.json,TRUE,Says judges get better benefits at a lower cost than everybody else in the state.,pensions,chris-christie,Governor of New Jersey,New Jersey,republican,10,17,27,19,8,a news conference,ChrisChristie,134939.0
180,180,5524.json,TRUE,There are a lot of casinos across the country that have gone bankrupt.,"bankruptcy,economy,gambling,state-budget,state-finances,states",robert-jacquard,State representative,Rhode Island,democrat,0,0,0,0,0,a speech,RobertJacquard,64.0
181,181,5044.json,TRUE,Small businesses create 70 percent of the jobs in America.,"economy,jobs,small-business",eric-cantor,House Majority Leader,Virginia,republican,9,6,4,4,4,a news release.,EricCantor,279310.0
183,183,8090.json,half-true,"Over 12,000 school kids were arrested in Florida. It makes Florida the nations leader in that area.","children,crime,education",dream-defenders,,Florida,none,0,0,1,0,0,"a meeting with Wansley Walters, Florida Department of Juvenile Justice Secretary",Dreamdefenders,66935.0
184,184,13069.json,mostly-true,If Texas were a country our economy would rank # 10...in the WORLD.,"corrections-and-updates,economy,states",greg-abbott,governor,Texas,republican,11,3,8,6,5,a tweet,GregAbbott_TX,246227.0
185,185,6969.json,FALSE,There are more oil rigs in operation in the United States than the rest of the world combined.,"corporations,debt,economy,energy,environment,federal-budget,gas-prices,government-regulation,infrastructure",david-cicilline,mayor of Providence,Rhode Island,democrat,7,4,5,4,1,a debate,davidcicilline,82461.0
186,186,8733.json,half-true,"Payday lenders profit from the poor by charging 1,000-plus percent interest.",financial-regulation,wendy-davis,state senator,Texas,democrat,5,1,8,12,1,a press release,wendydavis,196205.0
187,187,7785.json,half-true,"The Social Security trust fund is sound. Without anything being done, it would function well into 2038; and even after that time with no changes, we could pay 80 percent of the benefits that people have earned.",social-security,marcy-kaptur,Representative from Ohio's Ninth Congressional District,Ohio,democrat,0,2,4,4,0,House of Representatives floor speech ,RepMarcyKaptur,19671.0
190,190,2269.json,mostly-true,The Republicans have 2 percent of the Muslim vote.,religion,tamara-holder,attorney and contributor to Fox News,Illinois ,none,0,0,0,1,0,comments on the Hannity show.,tamaraholder,19264.0
194,194,1053.json,TRUE,"In Texas, the No. 1 name for new male babies many of whom will vote one day is Jose.","elections,immigration,pundits",mike-murphy,political strategist,,republican,0,0,0,0,0,a column in Time magazine.,murphymike,89606.0
195,195,11731.json,mostly-true,Marco Rubio voted against authorizing President Obama to strike Syria after Assad used chemical weapons on his own people.,"candidates-biography,congress,foreign-policy,history,terrorism",hillary-clinton,Presidential candidate,New York,democrat,40,29,69,76,7,a posting on the Clinton website,HillaryClinton,24462722.0
196,196,1059.json,FALSE,"Under the Cash for Clunkers program, all we've got to do is ... go to a local junkyard, all you've got to do is tow it to your house. And you're going to get $4,500.","pundits,transportation",sean-hannity,Radio/TV host,,none,3,5,3,2,1,a Fox News interview,seanhannity,4070059.0
199,199,5312.json,pants-fire,David Dewhurst has a record of promoting an income tax.,taxes,ted-cruz,Senator,Texas,republican,36,33,15,19,8,a handout.,tedcruz,3321920.0
202,202,3003.json,FALSE,"In the last five years, 28,000 people have been killed along the U.S.-Mexico border.","crime,homeland-security,immigration",lamar-smith,Congressman,Texas,republican,2,5,1,3,0,a news release,LamarSmithTX21,27143.0
203,203,6265.json,barely-true,The state of Ohio has one of the lowest unemployment rates in the nation right now and is leading the pack in terms of job creation.,"economy,jobs",bill-johnson,U.S. representative,Ohio,republican,2,1,0,0,0,a telephone town hall meeting,RepBillJohnson,35948.0
204,204,5689.json,FALSE,Says Obama health reform law denies millions access to affordable insurance.,"health-care,workers",eric-hovde,,,republican,2,3,3,0,0,a blog post,EricHovde,2249.0
205,205,13370.json,barely-true,Says HB2 hasnt moved the needle one iota on North Carolinas economy.,"corporations,economy,gays-and-lesbians,state-finances,states",john-skvarla,N.C. Secretary of Commerce,North Carolina,republican,1,0,0,0,0,a speech in Charlotte,JohnSkvarla,81.0
206,206,2347.json,FALSE,Close to 30% of our federal prison population consists of illegal immigrants.,immigration,daniel-mielke,Farmer,Wisconsin,republican,0,1,0,0,0,a statement on campaign web site,DanielDMielke,24.0
208,208,11636.json,FALSE,"The Family Research Council, according to some government agencies, is a terrorist group.",terrorism,ben-carson,,,republican,7,12,3,2,4,an interview on CNN,SecretaryCarson,276891.0
210,210,7123.json,TRUE,Says that in the 1985 election former Gov. Tom Kean had the largest winning margin for a gubernatorial candidate in Jersey history.,"elections,states",raymond-bateman,,,republican,0,1,0,0,0,a column,RaymondBateman,2.0
211,211,6289.json,FALSE,Obamacare is the biggest tax increase in American history.,"corrections-and-updates,federal-budget,health-care,taxes",mark-neumann,Developer and homebuilder,Wisconsin,republican,2,4,1,2,1,an interview,MarkNeumannnn,1153.0
212,212,772.json,TRUE,You ... said that Barack Obama was not ready to be commander in chief.,candidates-biography,sarah-palin,,Alaska,republican,9,19,9,6,6,"St. Louis, Mo.",SarahPalinUSA,1515110.0
213,213,8766.json,mostly-true,"The median male worker in this country has not seen a raise, inflation adjusted, for 30 years, basically.","economy,jobs,labor,workers",rana-foroohar,Assistant managing editor for Time,,none,0,0,0,1,0,a CNN interview,RanaForoohar,18269.0
214,214,2332.json,barely-true,Milwaukee Mayor Tom Barrett has held the line on property taxes.,"job-accomplishments,taxes",barack-obama,President,Illinois,democrat,70,71,160,163,9,a speech at a campaign fund-raiser for Tom Barrett's gubernatorial campaign,BarackObama,105971685.0
216,216,7261.json,TRUE,"Unlike the gridlock in Washington, more than 80 percent of the bills we passed during this General Assembly had bipartisan support.","bipartisanship,job-accomplishments",tom-niehaus,President of the Ohio Senate,Ohio,republican,0,0,0,0,1,an online video,CasaDiPace,149.0
217,217,6780.json,FALSE,Josh Mandel is lying about his own record. The rating of Ohios investment fund has NOT improved.,"job-accomplishments,message-machine-2012,state-finances",sherrod-brown,U.S. Senator,Ohio,democrat,3,4,5,8,1,a campaign commercial,SenSherrodBrown,369591.0
219,219,4267.json,half-true,On how money from a possible lease of the Ohio Turnpike would be used,"infrastructure,transportation",john-kasich,"Governor of Ohio as of Jan. 10, 2011",Ohio,republican,9,8,10,18,3,an interview,JohnKasich,948445.0
220,220,1434.json,mostly-true,"At the beginning of the last decade ... America had a budget surplus of over $200 billion. By the time I took office, we had a one-year deficit of over $1 trillion and projected deficits of $8 trillion over the next decade.","economy,federal-budget",barack-obama,President,Illinois,democrat,70,71,160,163,9,his State of the Union speech,BarackObama,105967800.0
224,224,13380.json,mostly-true,There are Justice Department policies against FBI Director James Comey discussing details of a federal investigation so close to an election.,"criminal-justice,government-regulation",robby-mook,Campaign manager for Hillary Clinton,New York,democrat,0,0,0,2,0,"comments on ""Meet the Press""",RobbyMook,82826.0
226,226,681.json,TRUE,"Joe Biden ""voted against the first Gulf War. He opposed the surge. He wanted to partition Iraq.""",iraq,lindsey-graham,U.S. senator,South Carolina,republican,2,2,4,2,0,an interview on ABC News' <i> This Week </i>,LindseyGrahamSC,833163.0
227,227,6693.json,barely-true,Says Rush Limbaugh made it clear hed rather see the country fail than President Barack Obama succeed.,bipartisanship,mark-strama,Small business owner,Texas,democrat,1,0,0,0,0,remarks to Texas delegates to the Democratic National Convention.,markstrama,1772.0
228,228,827.json,half-true,One percent of the American people make over 21 percent of all the income in America. That wasnt the way before George Bush became president.,taxes,joe-biden,U.S. senator,Delaware,democrat,11,10,21,16,4,a TV interview,JoeBiden,3550580.0
230,230,7754.json,mostly-true,"Says that under Rick Perrys plan, Texas has cut funding for public schools by 25%.","children,education,state-budget,state-finances",fix-austin-schools,,,none,0,0,0,1,0,a leaflet.,FixAustinSchool,23.0
233,233,6881.json,mostly-true,High school students arrested on campus are twice as likely not to graduate and four times less likely to graduate if theyve appeared in court.,"criminal-justice,education",steven-teske,Clayton County Juvenile Court Judge,,none,0,0,0,1,0,an article,scteskelaw,2350.0
238,238,9133.json,barely-true,David Alameel is giving thousands of dollars to support the Republican Party candidates including John Cornyn and Greg Abbott.,"bipartisanship,campaign-finance,candidates-biography",kesha-rogers,,Texas,democrat,1,0,1,0,0,an interview,KeshaRogersTX,465.0
239,239,4811.json,TRUE,The American healthcare system burns 18 percent of our national GDP. Nobody else is close.,"federal-budget,health-care",sheldon-whitehouse,U.S. Senator,Rhode Island,democrat,2,3,2,7,0,a speech,SenWhitehouse,318872.0
240,240,4317.json,FALSE,Providences port is 200 miles closer to Europe than any other Eastern port.,"economy,infrastructure,trade,transportation",james-bennett,"director, Department of Economic Development, Providence, R.I.",Rhode Island,newsmaker,0,1,0,0,1,a news conference,James_L_Bennett,2853.0
241,241,5627.json,TRUE,Says you need a photo ID to purchase Sudafed in Texas.,"elections,legal-issues",rick-perry,Governor,Texas,republican,30,30,42,23,18,a Fox News interview.,SecretaryPerry,88194.0
243,243,4327.json,mostly-true,"Says allowing the payroll tax holiday to expire would end up costing another estimated 900,000 jobs in 2012.",taxes,jeff-merkley,U.S. Senator,Oregon,democrat,0,1,3,6,0,letter to a constituent,JeffMerkley,103314.0
244,244,451.json,half-true,Hillary Clinton supported NAFTA and permanent China trade. Pennsylvania lost thousands of jobs.,foreign-policy,barack-obama,President,Illinois,democrat,70,71,160,163,9,a mailer to Pennsylvania voters,BarackObama,105967800.0
248,248,11772.json,FALSE,We now have driven (health care) costs down to the lowest theyve been in 50 years.,health-care,hillary-clinton,Presidential candidate,New York,democrat,40,29,69,76,7,comments during the South Carolina Democratic presidential debate,HillaryClinton,24462722.0
251,251,1226.json,mostly-true,"In the 1950s, ""A lot of people got rich and they had to pay a top tax rate of 90 percent.""",taxes,michael-moore,Documentary filmmaker,,none,2,5,1,6,0,"in his movie ""Capitalism: A Love Story""",MMFlint,6042992.0
252,252,11656.json,mostly-true,"The Charleston, S.C., shootershould have never been given a gun, but the universal background check was not fast enough.","corrections-and-updates,guns,homeland-security",hillary-clinton,Presidential candidate,New York,democrat,40,29,69,76,7,an interview with George Stephanopoulos,HillaryClinton,24462722.0
253,253,240.json,barely-true,Sixty-five percent of the Iraqi people now say it's okay to shoot an American soldier.,iraq,bill-richardson,Governor,New Mexico,democrat,1,2,3,8,1,a debate in Las Vegas,WBRichardson,718.0
254,254,3197.json,FALSE,Twelve judges have thrown out legal challenges to the health care law because they rejected the notion that the health care law was unconstitutional.,"health-care,supreme-court",barack-obama,President,Illinois,democrat,70,71,160,163,9,an interview on Fox,BarackObama,105967801.0
255,255,5297.json,half-true,Says Gov. Chris Christies proposal to reduce state income taxes would be the second tax cut for the rich by the governor in two years.,taxes,paul-sarlo,State Senator,New Jersey,democrat,0,0,1,0,0,opening remarks at a Senate committee hearing,PaulASarlo,2992.0
256,256,968.json,TRUE,Warren (Buffett) still does support me.,economy,barack-obama,President,Illinois,democrat,70,71,160,163,9,a television interview,BarackObama,105967801.0
257,257,5922.json,TRUE,Says George LeMieux was one of two Republicans who voted for President Barack Obamas jobs bill.,"candidates-biography,jobs",connie-mack,U.S. representative from Fort Myers,Florida,republican,3,3,1,3,1,a Web ad,ConnieMackIV,22098.0
259,259,5813.json,mostly-true,"About 230,000 people that were on unemployment when I took office are not on unemployment now.","economy,workers",rick-scott,Governor,Florida,republican,28,23,38,34,7,radio interview,SenRickScott,242080.0
260,260,7884.json,barely-true,"One person, Kathleen Sebelius, was going to determine whether or not 10-year-old lung patient Sarah Murnaghan would live or die.","children,health-care,public-health,pundits",rush-limbaugh,Radio host,,none,9,11,5,2,10,his radio show,rushlimbaugh,599203.0
261,261,2411.json,pants-fire,Ron Klein repeatedly voted in favor of amnesty for illegal immigrants.,immigration,allen-west,"U.S. representative, Florida District 22",Florida,republican,6,9,3,1,4,a campaign website,AllenWest,754173.0
262,262,8428.json,FALSE,Local law enforcement . . . will have access to the [Obamacare] Data Hubs treasure trove of personal info.,"criminal-justice,health-care,legal-issues,privacy",evan-feinberg,"President, Generation Opportunity","Washington, D.C.",activist,0,1,0,0,0,a Providence Journal commentary,evanfeinberg,1970.0
263,263,1391.json,TRUE,"During his tenure as mayor, he saw Houstons crime rates drop to the lowest levels in more than 25 years.",crime,bill-white,Former mayor of Houston,Texas,democrat,2,3,5,7,3,the biography on his campaign Web site,whitebil,2615.0
265,265,490.json,barely-true,"John McCain, ""one of the richest people in a Senate filled with millionaires,"" says the solution to the housing crisis is for people to get a ""second job"" and ""skip their vacations.""",economy,moveon,,,democrat,2,4,3,0,0,an e-mail,MoveOn,340177.0
266,266,8489.json,FALSE,"Terry McAuliffe wants to raise your taxes $1,700 to pay for his infinite promises.","education,state-budget,taxes",ken-cuccinelli,Attorney General,Virginia,republican,1,10,3,2,1,a debate.,KenCuccinelli,22670.0
269,269,1775.json,half-true,Says federal law enforcement officers cut off questioning of the Christmas Day underwear bomber by giving him a Miranda warning after 30 minutes of questioning.,"crime,homeland-security,legal-issues,terrorism,abc-news-week",rudy-giuliani,Attorney,New York,republican,9,11,10,7,3,an interview on ABC's This Week,RudyGiuliani,296687.0
270,270,1347.json,half-true,On legalizing illegal immigrants.,immigration,lou-dobbs,,,none,1,2,0,1,0,an interview on Telemundo,LouDobbs,1928372.0
272,272,534.json,half-true,"We are ""borrowing Saudi money for Saudi oil"" with the result being ""dependency and debt.""",energy,john-mccain,U.S. senator,Arizona,republican,31,39,31,37,8,"Houston, Texas",SenJohnMcCain,3151858.0
276,276,10356.json,barely-true,The difference over the (previous) four years between where things were headed and where we brought them to over the last four years is a total of $816 in saved property tax money.,"state-budget,state-finances,taxes",scott-walker,Milwaukee County Executive,Wisconsin,republican,26,41,32,40,11,remarks to reporters,ScottWalker,281971.0
277,277,8385.json,half-true,Chris Christie has not increased the taxes on anyone.,taxes,kim-guadagno,Lieutenant Governor of New Jersey,,republican,0,2,1,0,0,a speech to supporters in Carlstadt,KimGuadagnoNJ,11426.0
278,278,7386.json,barely-true,The United States does not have a system through which growers and dairies can bring a workforce legally into the U.S.,"agriculture,immigration,workers",marco-rubio,U.S. Senator,Florida,republican,33,24,32,35,5,a blog post on RedState.com,marcorubio,3872341.0
279,279,3195.json,FALSE,Says he never said he would keep education funding the same.,"education,state-budget",rick-scott,Governor,Florida,republican,28,23,38,34,7,talking about his budget proposal.,SenRickScott,242080.0
280,280,12497.json,TRUE,"Since 1978, college tuition nationwide has gone up something like four times the rate of inflation.",education,scott-walker,Milwaukee County Executive,Wisconsin,republican,26,41,32,40,11,a radio interview,ScottWalker,281971.0
281,281,13293.json,half-true,"Says Sen. Rob Portman said, It would be irresponsible not to cut Medicare.",medicare,ted-strickland,Former Ohio governor,Ohio,democrat,2,6,7,4,1,in a Ohio senatorial candidate debate,Ted_Strickland,16287.0
283,283,689.json,FALSE,(Palin) supported right-wing extremist Pat Buchanan for president in 2000.,israel,moveon,,,democrat,2,4,3,0,0,an e-mail.,MoveOn,340177.0
286,286,7303.json,half-true,"Washington, D.C., had some of the strictest gun laws in the country. And when they passed them, violence skyrocketed.","crime,criminal-justice,drugs,government-regulation,guns,public-safety",marco-rubio,U.S. Senator,Florida,republican,33,24,32,35,5,an interview on Fox News,marcorubio,3872341.0
288,288,5429.json,FALSE,"While fighting a move to toughen penalties for workplace gender discrimination, state Sen. Glenn Grothman said he didnt believe women belonged in the workplace but belonged at home, cooking and cleaning and having babies.","jobs,legal-issues,women",christine-sinicki,State Representative 20th District,Wisconsin,democrat,0,1,0,0,0,a legislative floor speech,sinicki328,36.0
289,289,5852.json,FALSE,"If you put the $47 billion in revenue (raised over 10 years by the Buffett rule) into infrastructure you could create 611,000 infrastructure jobs.","economy,federal-budget,jobs,transportation",sheldon-whitehouse,U.S. Senator,Rhode Island,democrat,2,3,2,7,0,a speech on the floor of the U.S. Senate,SenWhitehouse,318872.0
291,291,599.json,TRUE,I have repeatedly said that many of the predatory loans that were made in the mortgage system did target African-American and Latino communities.,economy,barack-obama,President,Illinois,democrat,70,71,160,163,9,"a town hall in St. Petersburg, Fla.",BarackObama,105967801.0
292,292,10411.json,mostly-true,"Starting in December 2007, 1.4 million jobs were created in Texas. In that same period, the rest of the country lost 400,000 jobs.","job-accomplishments,jobs",rick-perry,Governor,Texas,republican,30,30,42,23,18,valedictory speech as governor to the Texas Legislature,SecretaryPerry,88194.0
293,293,3809.json,barely-true,The (health reform) legislation which Washington passed last year has made it more difficult to hire because its increased costs for employers.,"economy,health-care",rob-portman,U.S. senator from Ohio,Ohio,republican,3,5,11,11,1,a press availability following a policy luncheon,robportman,20319.0
294,294,3928.json,barely-true,"The CBO, the Congressional Budget Office has said that Obamacare will kill 800,000 jobs.","economy,health-care",michele-bachmann,Congresswoman,Minnesota,republican,8,22,6,4,16,a debate in New Hampshire,MicheleBachmann,251527.0
295,295,135.json,barely-true,"Thompson ""voted against $250,000 caps on damages (and) almost anything that would make our legal system fairer.""",legal-issues,rudy-giuliani,Attorney,New York,republican,9,11,10,7,3,"a Republican debate in Orlando, Fla.",RudyGiuliani,296687.0
296,296,10580.json,pants-fire,Texas this fiscal year will have more money in reserve than the other 49 states combined.,"state-budget,state-finances,states",dan-patrick,Lieutenant governor-elect,Texas,republican,4,4,3,4,4,an interview on KLBJ AM in Austin,DanPatrick,52344.0
297,297,610.json,FALSE,On using the Strategic Petroleum Reserve.,energy,barack-obama,President,Illinois,democrat,70,71,160,163,9,,BarackObama,105967802.0
298,298,7916.json,mostly-true,Immigrants are more fertile.,immigration,jeb-bush,,Florida,republican,17,5,17,24,2,a speech at the Faith and Freedom Coalition Conference,JebBush,1421800.0
300,300,1659.json,pants-fire,The number of uninsured people in Massachusetts is about the same as it was when the mandates were passed in 2006.,"health-care,states",rick-perry,Governor,Texas,republican,30,30,42,23,18,a column,SecretaryPerry,88194.0
301,301,8601.json,mostly-true,Firearms homicides are down about 40 percent since Texas passed concealed-gun permit law.,"civil-rights,crime,guns",jerry-patterson,state land commissioner,Texas,republican,1,1,1,3,0,an online campaign video,Patterson4TX,4731.0
303,303,4347.json,pants-fire,We spend less on defense today as % of GDP than at any time since Pearl Harbor.,federal-budget,newt-gingrich,"Co-host on CNN's ""Crossfire""",Georgia,republican,16,15,20,10,11,a Twitter post,newtgingrich,2117890.0
304,304,256.json,mostly-true,If you got rid of the income tax today you'd have about as much revenue as we had 10 years ago.,taxes,ron-paul,U.S. representative,Texas,republican,5,8,8,8,3,a <i>Meet the Press</i> interview,RonPaul,642429.0
305,305,2750.json,half-true,"Says Scott Walker wants to ban common forms of birth control, including the pill.","abortion,message-machine",tom-barrett,Mayor of Milwaukee,Wisconsin,democrat,2,5,8,5,3,a campaign TV ad,Barrett4MKE,13367.0
308,308,9745.json,half-true,"Top U.S. intelligence officials have toldevery member of Congress, including the president, were about to be attacked in a serious way because (of) the threat emanating from Syria and Iraq.","iraq,terrorism",lindsey-graham,U.S. senator,South Carolina,republican,2,2,4,2,0,"comments on ""Fox News Sunday""",LindseyGrahamSC,833163.0
