,Unnamed: 0,jsonid,label,headline_text,subject,speaker,speakerjobtitle,stateinfo,partyaffiliation,barelytruecounts,falsecounts,halftruecounts,mostlytrueocunts,pantsonfirecounts,context,twitter_handle,followers
312,312,1171.json,barely-true,The government is going to have the right to get into your bank account with the health care bill and make transfers without you knowing it.,"health-care,pundits",rush-limbaugh,Radio host,,none,9,11,5,2,10,his radio program,rushlimbaugh,599203.0
314,314,8308.json,barely-true,The American people support defunding Obamacare and oppose shutting down the government.,health-care,marco-rubio,U.S. Senator,Florida,republican,33,24,32,35,5,a press release,marcorubio,3872341.0
315,315,7217.json,half-true,Report that #GOP insisting on changes to Social Security as part of #fiscalcliff false. BTW those changes are supported by @barackobama.,"federal-budget,social-security",marco-rubio,U.S. Senator,Florida,republican,33,24,32,35,5,in a tweet,marcorubio,3872341.0
316,316,2824.json,TRUE,"Nobody has played clips over and over ...of President Obama (saying), If they bring a knife to the fight, well bring a gun.","candidates-biography,pundits",joyce-kaufman,WFTL 850 AM talk show host,Florida,talk-show-host,0,0,0,0,0,a radio show,joyceonair,3942.0
317,317,3730.json,pants-fire,The people of Rhode Island dont want same-sex marriage.,"civil-rights,gays-and-lesbians,marriage,polls",christopher-plante,"executive director, National Organization for Marriage - Rhode Island",Rhode Island,newsmaker,0,0,0,1,1,a television interview,Chris91UconnBoY,101.0
318,318,3672.json,half-true,"Rep. Paul Ryans Medicare plan lines the pockets of the private insurance companies, increases costs for seniors and does not reduce the deficit.","deficit,federal-budget,medicare,taxes",gerry-connolly,U.S. Representative,Virginia,democrat,1,0,4,1,0,a press release.,GerryConnolly,47383.0
319,319,6318.json,barely-true,This year in Congress (Connie Mack IV) has missed almost half of his votes.,candidates-biography,dave-weldon,,Florida,republican,2,0,0,0,1,a robocall,Davweldon,359.0
320,320,10198.json,barely-true,"1/3 of our kids drop out (of high school), cannot go to college or start a career.","corrections-and-updates,education",jeb-bush,,Florida,republican,17,5,17,24,2,a fundraising letter,JebBush,1421800.0
323,323,12581.json,barely-true,"You cant get on an airplane, but more than 2,000 people on that list have been able to buy a gun.","guns,terrorism",john-garamendi,U.S. House of Representatives,California,democrat,1,0,0,1,0,a speech.,RepGaramendi,27856.0
325,325,2143.json,half-true,"For every $1 spent on afterschool programs, we can save over $5, almost $6, in crime costs down the line.","crime,economy,education,poverty",peter-kilmartin,state representative,Rhode Island,democrat,0,0,2,1,1,a speech at the state Democratic convention,PeterFKilmartin,486.0
328,328,11196.json,barely-true,Over 40 percent of small and mid-size banks that loan money to small businesses have been wiped out since Dodd-Frank has passed.,financial-regulation,marco-rubio,U.S. Senator,Florida,republican,33,24,32,35,5,the first GOP primary debate.,marcorubio,3872341.0
329,329,2917.json,barely-true,You cant check out a library book without a photo ID.,legal-issues,david-dewhurst,Lieutenant governor,Texas,republican,8,8,10,5,5,an interview.,DavidHDewhurst,12650.0
330,330,11555.json,pants-fire,Says that Starbucks took Christmas off of their brand new cups.,religion,joshua-feuerstein,,,republican,0,0,0,0,1,a video,TheEvangel1st,19.0
332,332,13223.json,FALSE,"Hillary Clinton supports unlimited abortion on demand up until the moment of birth, including partial-birth abortion, with taxpayer funding.",abortion,ted-cruz,Senator,Texas,republican,36,33,15,19,8,responding to an audience member's question at the Texas Tribune Festival.,tedcruz,3321919.0
334,334,2060.json,mostly-true,"We went from losing 3 million jobs in the last six months of the Bush Administration, adding almost 600,000 private sector jobs in the first six months of the year.","economy,government-efficiency,job-accomplishments",joe-biden,U.S. senator,Delaware,democrat,11,10,21,16,4,a news conference,JoeBiden,3550581.0
335,335,4687.json,half-true,The STAR Ohio fund just received the highest possible credit rating one of these funds can receive.,"economy,job-accomplishments,state-finances",josh-mandel,Ohio treasurer,Ohio,republican,4,5,4,5,6,an email to supporters,JoshMandelOhio,14740.0
337,337,5235.json,mostly-true,"In the last 22 months, businesses have created more than 3 million jobs. Last year, they created the most jobs since 2005.","corrections-and-updates,economy,jobs",barack-obama,President,Illinois,democrat,70,71,160,163,9,the State of the Union address,BarackObama,105967804.0
338,338,8210.json,half-true,"Every year, more than $40 million are leaving Missouri for the Lone Star State.",economy,rick-perry,Governor,Texas,republican,30,30,42,23,18,a radio ad,SecretaryPerry,88194.0
339,339,12185.json,mostly-true,A college loan is the only loan in the United States that you cannot refinance when interest rates go down.,"debt,economy,education",bill-clinton,former president,Arkansas,democrat,4,2,12,11,3,a campaign speech,BillClinton,11075564.0
340,340,1192.json,mostly-true,The House of Representatives has never passed a resolution of disapproval to condemn a member's behavior.,history,john-boehner,Speaker of the House of Representatives,Ohio,republican,13,22,11,4,2,a floor speech,SpeakerBoehner,1404160.0
341,341,10295.json,mostly-true,"We are younger than our competitors, and this is entirely because of immigration.",immigration,barack-obama,President,Illinois,democrat,70,71,160,163,9,a speech to business leaders,BarackObama,105967804.0
342,342,4332.json,half-true,Recent international reports show the United States near the bottom among industrialized nations for k-12 academic achievement.,education,chip-rogers,State Senator,Georgia,republican,1,0,1,1,0,a town hall meeting,chiprogers,386.0
346,346,2925.json,half-true,They tried to give us $400 million to build a high-speed train that goes 39 miles an hour.,"infrastructure,stimulus,transportation",john-kasich,"Governor of Ohio as of Jan. 10, 2011",Ohio,republican,9,8,10,18,3,a CNN interview,JohnKasich,948445.0
348,348,4181.json,TRUE,President Reagan did it (raised the debt ceiling) 18 times. George W. Bush did it seven times.,"bipartisanship,federal-budget",barack-obama,President,Illinois,democrat,70,71,160,163,9,a televised address,BarackObama,105967803.0
349,349,3615.json,half-true,"According to David Cay Johnston, the average American pays about 22 percent of their income to federal taxes. The richest 400 Americans pay about 16 percent of their income to federal taxes.","pundits,taxes",chris-hayes,"Host, All In",,none,0,0,1,0,0,"an interview on MSNBC's ""The Rachel Maddow Show""",chrislhayes,1849021.0
350,350,9031.json,FALSE,"Most young Americans right now, theyre not covered by health insurance.",health-care,barack-obama,President,Illinois,democrat,70,71,160,163,9,"a Funnyordie.com ""Between Two Ferns"" interview with Zach Galifianakis",BarackObama,105967803.0
352,352,7765.json,TRUE,"Over the last 10 years, Texas created 33 percent of the net new jobs nationwide.","economy,job-accomplishments,jobs",rick-perry,Governor,Texas,republican,30,30,42,23,18,an advertisement,SecretaryPerry,88194.0
353,353,7887.json,pants-fire,Says two-thirds of groups targeted for IRS scrutiny were not conservative.,taxes,progress-texas,,Texas,none,3,0,1,0,2,a tweet,ProgressTX,10809.0
354,354,11407.json,pants-fire,"In the class of 1968 at Patrice Lumumba University in Moscow, Mahmoud Abbas was one of the members of that class, and so was Ali Khamenei. And thats where they first established relationships with the young Vladimir Putin.","foreign-policy,history",ben-carson,,,republican,7,12,3,2,4,an interview with CNN's Wolf Blitzer,SecretaryCarson,276891.0
355,355,1616.json,half-true,"Last week the Texas State Board of Education (SBOE), led by Rick Perrys appointee, voted to remove Thomas Jefferson from social studies textbook standards. Thats right. Thomas Jefferson... was deleted from a list of historical figures who inspired political change.",education,bill-white,Former mayor of Houston,Texas,democrat,2,3,5,7,3,an e-mail,whitebil,2615.0
357,357,35.json,TRUE,"You know we can't just pull out now... The truth of the matter is: If we started today, it would take one year, one year to get 160,000 troops physically out of Iraq, logistically.",iraq,joe-biden,U.S. senator,Delaware,democrat,11,10,21,16,4,"CNN/YouTube debate in Charleston, S.C.",JoeBiden,3550581.0
359,359,8147.json,half-true,"Says that while Foster was mayor, Rick Kriseman was ineffective in the Florida House of Representatives because there was no legislation that passed the House that had (Krisemans) name on it.","florida,states",bill-foster,"Mayor, St. Petersburg",Florida,republican,1,0,2,2,0,a mayoral forum,RepBillFoster,40637.0
361,361,1693.json,FALSE,Cell phone numbers go public this month.,consumer-safety,ken-legler,State House representative,Texas,republican,0,1,0,0,0,Facebook and Twitter posts,KenLegler,2376.0
365,365,6449.json,FALSE,The Obama administration is unwinding our nations welfare-to-work requirements.,welfare,bob-mcdonnell,Governor,Virginia,republican,6,5,7,6,3,an op-ed.,BobMcDonnell,29625.0
367,367,8998.json,half-true,The Redskins Training Camp deal generated $40 million in new private investment in the city.,"city-government,job-accomplishments",dwight-jones,"Mayor, City of Richmond",Virginia,democrat,1,1,1,1,0,a speech,DwightJones21,779.0
369,369,10252.json,half-true,There are more people living in this country who were not born here than at anytime in the history of the country.,immigration,rick-santorum,,Pennsylvania,republican,12,16,13,7,5,"an interview on CNN's ""State of the Union""",RickSantorum,289948.0
370,370,9393.json,half-true,Says Hillary Clinton defended Syrias President Assad as a possible reformer at the start of that countrys civil war.,foreign-policy,chris-wallace,Fox News Sunday host,,none,0,0,3,1,0,"comments on ""Fox News Sunday""",ChrisWallace101,29838.0
372,372,11291.json,mostly-true,As many as six federal department budget bills have been delayed because of opposition to amendments that would ban Confederate battle flag sales at federal building gift shops.,"congress,federal-budget,history",lloyd-doggett,Texas congressman in the U.S. Houst of Representatives,Texas,democrat,1,0,2,7,0,remarks in San Antonio,RepLloydDoggett,32540.0
376,376,3110.json,barely-true,"Republican (small business tax cut) bill spends $80 million for better Google searches, not job creation","small-business,taxes",cory-mason,"State Assembly member, 62nd District",Wisconsin,democrat,2,0,0,0,0,a news release,MayorCoryMason,3967.0
377,377,9294.json,mostly-true,A 2013 state law would allow the operator of an iron ore mine in northern Wisconsin to fill in pristine streams and ponds with mine waste.,environment,dan-kaufman,,,none,0,0,1,1,0,an opinion article,DarpaDan,1189.0
379,379,9853.json,FALSE,"If black America were a country, itd be the 15th wealthiest nation in the world.","corrections-and-updates,economy,poverty",larry-elder,Radio talk show host,,talk-show-host,1,3,0,0,0,comments on CNN,larryelder,522175.0
380,380,10931.json,half-true,"Since Republicans took over after the 2010 election, the graduation rate in Wisconsin has gone from 86 percent to 88 percent. The black graduation rate has gone from 60 percent to 65 percent. The Latino graduation rate has gone from 65 percent to 71 percent.",education,dale-kooyenga,State Representative,Wisconsin,republican,1,1,2,2,0,,DaleKooyenga,6202.0
381,381,11513.json,barely-true,"It has been estimated that nearly 40 percent of all guns sold in America are sold by private, unlicensed sellers either online or through gun shows.",guns,terry-mcauliffe,Governor,Virginia,democrat,12,6,2,2,3,an executive order.,TerryMcAuliffe,66566.0
382,382,979.json,TRUE,2008 was the deadliest year of the war (in Afghanistan) for American forces.,"afghanistan,military",barack-obama,President,Illinois,democrat,70,71,160,163,9,a speech at the White House. ,BarackObama,105967806.0
383,383,1702.json,mostly-true,"Florida teachers are ""already paid $5,000 below the national average.""",education,dan-gelber,,Florida,democrat,2,2,1,3,0,a letter posted on his campaign Web site.,MayorDanGelber,1426.0
385,385,6014.json,TRUE,Says Amanda Fritz manages less than 5 percent of city operations.,city-government,mary-nolan,Represents Southwest Portland in Oregon House,Oregon,democrat,0,0,3,0,0,a debate.,marybnolan,1820.0
387,387,3237.json,half-true,"Americans, in the last 30 years, have more than doubled the amount of money we are spending per child (on education) and the results have gotten worse, not better.",education,michelle-rhee,Founder and CEO of Students First,,none,0,0,1,0,0,talking to Florida legislators.,MichelleRhee,76771.0
388,388,3695.json,barely-true,Polls show that Floridians dont want to repeal the Affordable Care Act.,"health-care,polls",joe-gibbons,State Representative,Florida,democrat,1,0,0,0,0,comments on the House floor,JoeGibbonsEEA,2117.0
389,389,5631.json,FALSE,Says Congressman Bill Pascrell voted to remove the public option from the Affordable Health Care Act.,health-care,steve-rothman,,,democrat,1,2,0,1,1,an interview on NJToday,steve02476,149.0
390,390,10691.json,TRUE,"Lawmakers were paid for their off-season efforts to, for the first time, take the lead in drawing borders for two would-be cities.",state-finances,mary-margaret-oliver,State Representative,Georgia,democrat,0,0,1,0,0,a House floor debate,mmo_mary,3233.0
391,391,9969.json,pants-fire,Greg Abbott and his surrogates have referred to women who have been the victims of rape or incest as though somehow what they are confronting is a minor issue.,"crime,ethics",wendy-davis,state senator,Texas,democrat,5,1,8,12,1,speaking to reporters,wendydavis,196205.0
392,392,9784.json,TRUE,On offshore drilling for energy,"energy,voting-record",mark-warner,U.S. Senator,Virginia,democrat,3,1,6,3,0,,MarkWarner,443560.0
395,395,5047.json,half-true,"Enacting the Right-to-Carry Act would amount to expanding the rights of sex offenders, terrorists, child predators, and abusers to carry concealed weapons across state lines.","crime,guns,legal-issues,public-safety",david-cicilline,mayor of Providence,Rhode Island,democrat,7,4,5,4,1,a fundraising letter,davidcicilline,82461.0
398,398,6674.json,mostly-true,Says Georgia will send more state money per child to state charter schools and that budget cuts are not applied to those charter schools.,education,herb-garrett,Executive Director of the Georgia School Superintendents Association,Georgia,none,0,0,0,1,0,a letter,cook_n_good,9.0
402,402,9382.json,half-true,"Nathan Deal cut the HOPE scholarship program so that literally 100,000 Georgians will not be able to go to college or get technical training that they so badly needed to raise -- you know, give them a chance at a good job.",education,peter-shumlin,governor and chair of Democratic Governors Association,Vermont,democrat,0,0,1,0,0,MSNBC,GovPeterShumlin,21151.0
404,404,6517.json,half-true,I havent raised taxes in the time Ive been the governor of New Jersey.,taxes,chris-christie,Governor of New Jersey,New Jersey,republican,10,17,27,19,8,a news conference,ChrisChristie,134939.0
406,406,88.json,pants-fire,I'm probably one of the four or five best-known Americans in the world.,candidates-biography,rudy-giuliani,Attorney,New York,republican,9,11,10,7,3,a comment to reporters in London.,RudyGiuliani,296687.0
407,407,9606.json,barely-true,We are accepting more legal immigrants than we ever have in the history (of the United States.),immigration,rick-santorum,,Pennsylvania,republican,12,16,13,7,5,"a ""Meet the Press"" pundit panel",RickSantorum,289948.0
409,409,8910.json,half-true,Six people in Florida die as a result of (not expanding Medicaid) every day.,"health-care,medicaid,poverty",charlie-crist,,Florida,democrat,15,9,20,19,2,"an interview on MSNBC's ""The Daily Rundown.""",CharlieCrist,31928.0
411,411,8174.json,barely-true,Only in Washington would politicians spend $27 million to teach Moroccans how to make pottery.,"federal-budget,government-efficiency",karen-handel,,,republican,2,0,3,3,1,a website posting,karenhandel,17928.0
412,412,348.json,TRUE,"Hillary Clinton ""starts off with 47 percent of the country against her.""",elections,barack-obama,President,Illinois,democrat,70,71,160,163,9,"a campaign rally in Alexandria, Va.",BarackObama,105967806.0
413,413,10141.json,FALSE,SaysRand Paulhas put out budgets to cut the military in half.,"federal-budget,military",adam-kinzinger,U.S. Representative,Illinois,republican,0,2,1,0,0,"comments on ABC's ""This Week""",RepKinzinger,49589.0
414,414,2569.json,half-true,Groups that receive foreign money are spending huge sums to influence American elections.,"campaign-finance,corporations,abc-news-week",barack-obama,President,Illinois,democrat,70,71,160,163,9,a speech,BarackObama,105967806.0
415,415,5803.json,TRUE,Says legislative cuts mean Texas is spending on average $500 less per student.,"education,state-budget",donna-howard,Texas House Representative,Texas,democrat,1,0,1,2,0,remarks at a Texas Capitol rally,DonnaHowardTX,15548.0
416,416,5345.json,half-true,"[A]t his current rate, President Obama will have added more debt to the United State of America by the end of his first term than each of the previous 43 presidents -- combined!",federal-budget,GaGOP,,,republican,2,1,1,0,0,a web post,GaRepublicans,17739.0
418,418,5970.json,mostly-true,Says Williamson County Attorney Jana Duty has never prosecuted a single adult felony case.,candidates-biography,john-bradley,Williamson County district attorney,Texas,republican,0,0,0,1,0,an op-ed in the Austin American-Statesman,johnbradleywest,88619.0
419,419,9666.json,FALSE,"The fundraising numbers are in, and our grassroots support is unmatched!","campaign-finance,elections",glenn-grothman,"State Senator, 20th District",Wisconsin,republican,2,4,1,1,0,in a Facebook posting,GrothmanforWI,1368.0
420,420,4416.json,mostly-true,Issue 2 makes it illegal for us to negotiate for enough firefighters to do the job.,"elections,labor",we-are-ohio,,Ohio,none,2,0,0,1,0,a campaign commercial,We_Are_Ohio,4637.0
421,421,3685.json,mostly-true,"Says although the unemployment rate seems to be improving, it does not reflect real job creation -- its caused by a shrinking of the actual labor force.","economy,jobs,pundits,abc-news-week",arianna-huffington,"Founder, The Huffington Post",,none,0,0,2,3,0,"a roundtable segment on ABC's ""This Week with Christiane Amanpour""",ariannahuff,2965910.0
423,423,685.json,barely-true,"Obama voted ""to cut off funding for our American troops on the battlefield.""",iraq,joe-lieberman,Senator,Connecticut,independent,1,1,0,2,0,"St. Paul, Minn.",JoeLieberman,31825.0
424,424,10562.json,mostly-true,"In general, it appears Wisconsins right to work bill would likely apply to the Green Bay Packers players and their union.","corporations,labor,sports,unions,workers",jon-erpenbach,"State Senator, District 27",Wisconsin,democrat,3,0,0,1,0,a Facebook post,JonErpenbach,6346.0
425,425,9630.json,mostly-true,"The so-called defense minister of the Peoples Republic of Donetsk ... actually posted a bragging social media posting of having shot down a military transport. And then when it became apparent it was civilian, they pulled it down from social media.","foreign-policy,military",john-kerry,Secretary of State,Massachusetts,democrat,3,2,2,5,0,"comments on ""Fox News Sunday""",JohnKerry,3355239.0
426,426,67.json,half-true,Democrats are kind of falling over each other seeing who can raise taxes faster. It looks like they're going to raise taxes anywhere between 20 to 30 percent.,taxes,rudy-giuliani,Attorney,New York,republican,9,11,10,7,3,"a speech in Laconia, New Hampshire.",RudyGiuliani,296687.0
428,428,8677.json,barely-true,"Gov. Scott Walker bought 80 new, brand-new vehicles for the state that we probably dont need.","government-efficiency,state-budget,state-finances,transportation",kathleen-vinehout,,,democrat,1,1,1,1,0,a meeting,VinehoutK,3633.0
429,429,6209.json,half-true,"Says he passed eight measures, including ones to prevent groping at airport security checks and to bar sanctuary cities in Texas.","candidates-biography,homeland-security,immigration,legal-issues,transportation",david-dewhurst,Lieutenant governor,Texas,republican,8,8,10,5,5,a speech to the Republican Party of Texas convention in Fort Worth.,DavidHDewhurst,12650.0
430,430,2837.json,FALSE,Its gotten to a point where the average federal worker makes twice as much as the average private sector worker.,"economy,federal-budget,government-efficiency",john-boehner,Speaker of the House of Representatives,Ohio,republican,13,22,11,4,2,a news conference,SpeakerBoehner,1404160.0
431,431,4589.json,FALSE,These 15 political appointees (on the IPAB) will make all the major health care decisions for over 300 million Americans.,"health-care,new-hampshire-2012,abc-news-week",michele-bachmann,Congresswoman,Minnesota,republican,8,22,6,4,16,a debate in New Hampshire,MicheleBachmann,251527.0
433,433,9169.json,TRUE,"Before our last three presidents, you have to go back to the 1800s, early 1800s to find three presidents in a row being consecutively re-elected.","elections,history",joe-scarborough,Host of a morning show on MSNBC,,none,1,4,3,3,0,"comments on MSNBC's ""Morning Joe""",JoeNBC,2544670.0
435,435,549.json,mostly-true,"The most recent Associated Press poll has Nader-Gonzalez at 6 percent, without any national coverage, against McCain and Obama.",elections,ralph-nader,"Attorney, activist",Connecticut,independent,1,1,0,1,0,"an interview with ""Democracy Now!,"" an independent radio program",RalphNader,76806.0
436,436,10000.json,half-true,"Dan Patrick said that if women get paid less than a man for the same job, that thats not a problem.","jobs,women",leticia-van-de-putte,Pharmacist,Texas,democrat,2,2,4,1,1,a debate in Austin,leticiavdp,30743.0
437,437,9409.json,half-true,"Weve got an average of 5,600 soldiers committing suicide. Thats about 20 a day.","health-care,veterans",david-scott,Congressman ,Georgia,democrat,0,0,2,1,0,WABE,repdavidscott,20537.0
438,438,10359.json,barely-true,"There have even been Republican congressmen who have said, If you give us more money we dont know where we would even put additional Border Patrol agents.",immigration,craig-melvin,NBC News correspondent and MSNBC host,,journalist,1,0,0,0,0,an MSNBC segment,craigmelvin,69061.0
439,439,5279.json,TRUE,"Today, for the first time in fifteen years, Master Locks unionized plant in Milwaukee is running at full capacity.","jobs,trade",barack-obama,President,Illinois,democrat,70,71,160,163,9,the State of the Union speech,BarackObama,105967806.0
440,440,13006.json,TRUE,Tom Reed has actually voted for every single trade deal that has ever come before him in any form.,"jobs,trade",john-plumb,Candidate for Congress,New York,democrat,0,0,0,0,0,an interview on Capital Tonight.,JohnFPlumb,603.0
442,442,5629.json,FALSE,New federal projections estimate that the health care overhaul will cost $1.76 trillion over 10 years -- well above the $940 billion Democrats originally claimed.,health-care,tom-price,Congressman,Georgia,republican,1,2,5,3,0,a press release,pricetom,9688.0
445,445,8443.json,mostly-true,"Common Core is not from the federal government, they do not have their fingerprints on this thing at all.","children,education,federal-budget,government-regulation",sondy-pope,State Representative,Wisconsin,democrat,0,1,1,1,0,a radio interview,RepSondy,1750.0
446,446,2806.json,FALSE,Social Security is indeed a Ponzi scheme.,social-security,rick-perry,Governor,Texas,republican,30,30,42,23,18,an interview.,SecretaryPerry,88194.0
450,450,7847.json,mostly-true,"In Miami-Dade County, we spend at our school system over $20 million every year educating recent immigrants.","education,immigration",carlos-curbelo,Miami-Dade school board member,Florida,republican,0,1,0,1,0,a Fox News interview,carloslcurbelo,21954.0
452,452,11264.json,TRUE,Trump proposed enacting the largest tax increase in American history.,"candidates-biography,taxes",jeb-bush,,Florida,republican,17,5,17,24,2,a fundraising email,JebBush,1421800.0
453,453,779.json,TRUE,"Senator McCain has been talking tough about earmarks, and that's good, but earmarks account for about $18-billion of our budget.",federal-budget,barack-obama,President,Illinois,democrat,70,71,160,163,9,"a debate in Nashville, Tenn.",BarackObama,105967806.0
454,454,12790.json,half-true,"Kim Myers voted repeatedly to raise taxes on the people of Broome County, but made millions off of tax savings when her family business relocated its headquarters.",taxes,claudia-tenney,Assemblywoman,New York,republican,0,0,1,0,0,a press release.,claudiatenney,7969.0
456,456,8637.json,TRUE,We pay among the highest tolls in the nation for the privilege of crossing that bridge.,transportation,loretta-weinberg,State Senator,,democrat,1,2,0,1,0,an interview on the John Gambling radio program,SenatorLorettaW,8135.0
458,458,7148.json,barely-true,Says real estate taxes were put in place to pay for Obamacare.,"health-care,taxes",todd-hunter,Lawyer,Texas,republican,1,0,0,0,0,a Texas Tribune interview.,toddahunter,5784.0
459,459,5663.json,half-true,Says today unemployment has been running near 12 percent or more for the last four years and the Legislature hasnt done much to lower it.,jobs,tim-knopp,,,republican,0,0,1,1,0,campaign website,SenatorKnopp,1685.0
460,460,1398.json,FALSE,Says Kay Bailey Hutchison voted for sanctuary cities.,immigration,rick-perry,Governor,Texas,republican,30,30,42,23,18,a debate.,SecretaryPerry,88194.0
