,Unnamed: 0,Unnamed: 0.1,raw_text,clean,label,sentiment_vector,vader_polarity,sentiment_score,sentiment_0,sentiment_1,sentiment_2
1486,1486,1486,"Newly Engaged Couple Receives Incredible Outpouring Of Insincerity From Family, Friends ",newli engag coupl receiv incred outpour insincer famili friend,1,"[0.0, 0.714, 0.286, 0.4939]",0,0.4939,0.0,0.7140000000000001,0.28600000000000003
1487,1487,1487,Biden To Decide On 2020 Run By January #WhatDoYouThink? ,biden decid run januari whatdoyouthink,1,"[0.0, 1.0, 0.0, 0.0]",0,0.0,0.0,1.0,0.0
1488,1488,1488,Doctor Has Troubling Amount Of Available Appointment Slots ,doctor troubl amount avail appoint slot,1,"[0.0, 1.0, 0.0, 0.0]",0,0.0,0.0,1.0,0.0
1489,1489,1489,Local Teen Walks In On Family Masturbating ,local teen walk famili masturb,1,"[0.0, 1.0, 0.0, 0.0]",0,0.0,0.0,1.0,0.0
1490,1490,1490,Man Appalled At Date Who Lied Slightly More Than Him On Online Dating Profile ,man appal date lie slight onlin date profil,1,"[0.0, 1.0, 0.0, 0.0]",0,0.0,0.0,1.0,0.0
1491,1491,1491,Vaping By The Numbers ,vape number,1,"[0.0, 0.435, 0.565, 0.0772]",1,0.0772,0.0,0.435,0.565
1492,1492,1492,"Man Hates Being Put In Position Where He Has To Think, Feel, Or Act ",man hate put posit think feel act,1,"[0.381, 0.619, 0.0, -0.5719]",0,-0.5719,0.381,0.619,0.0
1493,1493,1493,Poll: 81% Of Office Workers Would Rather Stay Late Than Ride Elevator With Richard ,poll offic worker would rather stay late ride elev richard,1,"[0.0, 1.0, 0.0, 0.0]",0,0.0,0.0,1.0,0.0
1494,1494,1494,‘New York Times’ Publishes Bombshell Anonymous Opinion Article From White House Insider ,new york time publish bombshel anonym opinion articl white hous insid,1,"[0.0, 1.0, 0.0, 0.0]",0,0.0,0.0,1.0,0.0
1495,1495,1495,"Cory Booker Expelled From Senate, Stripped Naked, Forced To Wander Maryland Bog In Woe For All Eternity… ",cori booker expel senat strip nake forc wander maryland bog woe etern,1,"[0.363, 0.637, 0.0, -0.6908]",0,-0.6908,0.363,0.637,0.0
1496,1496,1496,Eiffel Tower Finally Completed ,eiffel tower final complet,1,"[0.0, 1.0, 0.0, 0.0]",0,0.0,0.0,1.0,0.0
1497,1497,1497,"Deformed, Half-Feathered Audubon Society President Flees Into Forest After Injecting Self With Bird DNA… ",deform half feather audubon societi presid flee forest inject self bird dna,1,"[0.0, 1.0, 0.0, 0.0]",0,0.0,0.0,1.0,0.0
1498,1498,1498,New Study Confirms This Didn’t Even Feel Like A 4-Day Work Week ,new studi confirm even feel like day work week,1,"[0.0, 0.762, 0.238, 0.3612]",0,0.3612,0.0,0.762,0.23800000000000002
1499,1499,1499,MTA Official Too Nervous To Tell Commuters Waiting For Train That Service Shut Down Permanently An Hour Ago… ,mta offici nervous tell commut wait train servic shut perman hour ago,1,"[0.16, 0.84, 0.0, -0.2732]",0,-0.2732,0.16,0.84,0.0
1500,1500,1500,"‘Rock The Caliphate’ Charity Concert Features U2, Ed Sheeran, Dua Lipa Coming Together To Raise Money For Strugglin… ",rock caliph chariti concert featur u ed sheeran dua lipa come togeth rais money strugglin,1,"[0.0, 1.0, 0.0, 0.0]",0,0.0,0.0,1.0,0.0
1501,1501,1501,Man Discovers Huge Cache Of Rare Fossils While Walking Through Natural History Museum ,man discov huge cach rare fossil walk natur histori museum,1,"[0.0, 0.796, 0.204, 0.3182]",0,0.3182,0.0,0.7959999999999999,0.204
1502,1502,1502,2018 NFL Season Storylines To Watch ,nfl season storylin watch,1,"[0.0, 1.0, 0.0, 0.0]",0,0.0,0.0,1.0,0.0
1503,1503,1503,Man Who Treats Women With Respect Asked What His Secret Is ,man treat woman respect ask secret,1,"[0.0, 0.408, 0.592, 0.7003]",1,0.7003,0.0,0.408,0.5920000000000001
1504,1504,1504,Toyota Recalls 1993 Camry Due To Fact That Owners Really Should Have Bought Something New By Now… ,toyota recal camri due fact owner realli bought someth new,1,"[0.0, 1.0, 0.0, 0.0]",0,0.0,0.0,1.0,0.0
1505,1505,1505,Every One Of Man’s Priorities Unrecognizable To Grandfather ,everi one man prioriti unrecogniz grandfath,1,"[0.0, 1.0, 0.0, 0.0]",0,0.0,0.0,1.0,0.0
1506,1506,1506,Woman Overjoyed By Giant Uterine Parasite ,woman overjoy giant uterin parasit,1,"[0.0, 1.0, 0.0, 0.0]",0,0.0,0.0,1.0,0.0
1507,1507,1507,Several reports indicated that the utter dipshit struggled not to drool on himself while deeming the three-second l… ,sever report indic utter dipshit struggl drool deem three second l,1,"[0.256, 0.744, 0.0, -0.4767]",0,-0.4767,0.256,0.7440000000000001,0.0
1508,1508,1508,Poland Spring Develops New Eco-Friendly Bottle That Only Takes 300 Years To Decompose ,poland spring develop new eco friend bottl take year decompos,1,"[0.0, 0.738, 0.262, 0.4939]",0,0.4939,0.0,0.738,0.262
1509,1509,1509,Alex Jones Returns To Humble Roots Of Screaming Conspiracy Theories Through Megaphone At People In Park… ,alex jone return humbl root scream conspiraci theori megaphon peopl park,1,"[0.213, 0.787, 0.0, -0.4019]",0,-0.4019,0.213,0.787,0.0
1510,1510,1510,Facebook Employee Group Aims To Promote Political Diversity #WhatDoYouThink? ,facebook employe group aim promot polit divers whatdoyouthink,1,"[0.0, 1.0, 0.0, 0.0]",0,0.0,0.0,1.0,0.0
1511,1511,1511,"Nation’s Outfoxed Sheriffs Shake Heads, Throw Hats In Dirt ",nation outfox sheriff shake head throw hat dirt,1,"[0.406, 0.594, 0.0, -0.4767]",0,-0.4767,0.406,0.594,0.0
1512,1512,1512,Fucking Idiot Has Perfect GIF For That ,fuck idiot perfect gif,1,"[0.591, 0.087, 0.322, -0.4767]",-1,-0.4767,0.591,0.087,0.322
1513,1513,1513,‘The Onion’ Has Chosen To Publish An Anonymous Op-Ed From Two Sources Close To Trump Who Think Their Dad Is The Bes… ,onion chosen publish anonym op ed two sourc close trump think dad be,1,"[0.0, 1.0, 0.0, 0.0]",0,0.0,0.0,1.0,0.0
1514,1514,1514,Woman Would Have Had Awesome Time Aborting Fetus If It Weren’t For Angry Protestors Screaming Outside Clinic… ,woman would awesom time abort fetus angri protestor scream outsid clinic,1,"[0.213, 0.787, 0.0, -0.4019]",0,-0.4019,0.213,0.787,0.0
1515,1515,1515,Kavanaugh Surprised Senate Not Questioning Fact He Never Went To Law School ,kavanaugh surpris senat question fact never went law school,1,"[0.0, 1.0, 0.0, 0.0]",0,0.0,0.0,1.0,0.0
1516,1516,1516,Fabled Lost City Of Gold Finally Discovered Off I-95 Outside Baltimore ,fabl lost citi gold final discov outsid baltimor,1,"[0.247, 0.753, 0.0, -0.3182]",0,-0.3182,0.247,0.753,0.0
1517,1517,1517,Purina Introduces ‘Own Shit’ Dog Food Flavor ,purina introduc shit dog food flavor,1,"[0.419, 0.581, 0.0, -0.5574]",0,-0.5574,0.419,0.581,0.0
1518,1518,1518,Aging Tom Brady Decides To Conserve Energy By No Longer Returning Kicks ,age tom bradi decid conserv energi longer return kick,1,"[0.0, 1.0, 0.0, 0.0]",0,0.0,0.0,1.0,0.0
1519,1519,1519,Clothes Come To Forefront As Major Theme In This Year’s New York Fashion Week ,cloth come forefront major theme year new york fashion week,1,"[0.0, 1.0, 0.0, 0.0]",0,0.0,0.0,1.0,0.0
1520,1520,1520,New Poll Finds 86 Percent Of Americans Don't Want To Have A Country Anymore ,new poll find percent american want countri anymor,1,"[0.0, 0.843, 0.157, 0.0772]",0,0.0772,0.0,0.843,0.157
1521,1521,1521,Black Man Bids Tearful Goodbye To Family Before Daily Commute ,black man bid tear goodby famili daili commut,1,"[0.0, 1.0, 0.0, 0.0]",0,0.0,0.0,1.0,0.0
1522,1522,1522,Insurance Company Gets Fucked Over By Another Cancer Patient ,insur compani get fuck anoth cancer patient,1,"[0.612, 0.388, 0.0, -0.836]",-1,-0.836,0.612,0.38799999999999996,0.0
1523,1523,1523,New Free-Range Slaughterhouse Allows Livestock To Roam Freely On Killing Floor ,new free rang slaughterhous allow livestock roam freeli kill floor,1,"[0.278, 0.414, 0.308, -0.128]",0,-0.128,0.278,0.414,0.308
1524,1524,1524,World-Weary Garbage Man No Longer Shocked By Things People Throw Out ,world weari garbag man longer shock thing peopl throw,1,"[0.245, 0.755, 0.0, -0.3818]",0,-0.3818,0.245,0.755,0.0
1525,1525,1525,"'You Will Die Someday And It Will Be Sad,' All Man Thinking During Dinner With Parents ",die someday sad man think dinner parent,1,"[0.583, 0.417, 0.0, -0.7906]",-1,-0.7906,0.583,0.41700000000000004,0.0
1526,1526,1526,District Attorney Worked Way Up From Police Dog ,district attorney work way polic dog,1,"[0.0, 1.0, 0.0, 0.0]",0,0.0,0.0,1.0,0.0
1527,1527,1527,2018 NFL Season By The Numbers ,nfl season number,1,"[0.0, 0.606, 0.394, 0.0772]",0,0.0772,0.0,0.606,0.39399999999999996
1528,1528,1528,Study Finds All-Consuming Self-Pity Best Way To Win Back Ex-Partner ,studi find consum self piti best way win back ex partner,1,"[0.0, 0.529, 0.471, 0.8402]",0,0.8402,0.0,0.529,0.47100000000000003
1529,1529,1529,Nike Makes Colin Kaepernick Face Of New Ad Campaign #WhatDoYouThink? ,nike make colin kaepernick face new ad campaign whatdoyouthink,1,"[0.0, 1.0, 0.0, 0.0]",0,0.0,0.0,1.0,0.0
1530,1530,1530,Report: Dog’s Nose Must Really Itch If He Willing To Repeatedly Kick Self In Face That Hard ,report dog nose must realli itch will repeat kick self face hard,1,"[0.113, 0.887, 0.0, -0.1027]",0,-0.1027,0.113,0.887,0.0
1531,1531,1531,Shohei Ohtani Regrets Not Researching Which Teams Were Good Before Signing With Angels ,shohei ohtani regret research team good sign angel,1,"[0.239, 0.513, 0.248, 0.0258]",0,0.0258,0.239,0.513,0.248
1532,1532,1532,Disillusioned Woman Now Wondering If Any Of Her Magical Vagina Stones Have Healing Powers ,disillus woman wonder magic vagina stone heal power,1,"[0.0, 1.0, 0.0, 0.0]",0,0.0,0.0,1.0,0.0
1533,1533,1533,Carl Bernstein Weeps Uncontrollably After Learning Bob Woodward Wrote A President Book Without Him… ,carl bernstein weep uncontrol learn bob woodward wrote presid book without,1,"[0.27, 0.73, 0.0, -0.5719]",0,-0.5719,0.27,0.73,0.0
1534,1534,1534,Kavanaugh Panicking After Botching Part Of Confirmation Where He Asked If He Rejects Satan ,kavanaugh panick botch part confirm ask reject satan,1,"[0.278, 0.722, 0.0, -0.4019]",0,-0.4019,0.278,0.722,0.0
1535,1535,1535,Kavanaugh Packing Gun At Congressional Hearing In Case Parkland Father Tries To Shake His Hand Again… ,kavanaugh pack gun congression hear case parkland father tri shake hand,1,"[0.268, 0.523, 0.209, 0.0258]",0,0.0258,0.268,0.523,0.209
1536,1536,1536,"World’s Cartographers Continue Living Secret Life Of Luxury On Idyllic, Never Disclosed 8th Continent… ",world cartograph continu live secret life luxuri idyl never disclos th contin,1,"[0.0, 1.0, 0.0, 0.0]",0,0.0,0.0,1.0,0.0
1537,1537,1537,The Onion’s Guide To Twitch ,onion guid twitch,1,"[0.0, 1.0, 0.0, 0.0]",0,0.0,0.0,1.0,0.0
1538,1538,1538,Two-Faced House Guest Who Didn’t Need Anything Suddenly Wants Glass Of Water ,two face hous guest need anyth sudden want glass water,1,"[0.0, 0.874, 0.126, 0.0772]",0,0.0772,0.0,0.8740000000000001,0.126
1539,1539,1539,HBO Ending Its Skinemax Offerings #WhatDoYouThink? ,hbo end skinemax offer whatdoyouthink,1,"[0.0, 1.0, 0.0, 0.0]",0,0.0,0.0,1.0,0.0
1540,1540,1540,Company’s HR Manager Really Pushing Infinite-Deductible Health Care Plan ,compani hr manag realli push infinit deduct health care plan,1,"[0.0, 0.738, 0.262, 0.4939]",0,0.4939,0.0,0.738,0.262
1541,1541,1541,Report: More Americans Saving Money For Child’s Unemployment ,report american save money child unemploy,1,"[0.0, 0.61, 0.39, 0.4939]",0,0.4939,0.0,0.61,0.39
1542,1542,1542,Area Man Treats Girlfriend To Sumptuous 20-Second Massage ,area man treat girlfriend sumptuous second massag,1,"[0.0, 0.69, 0.31, 0.4019]",0,0.4019,0.0,0.69,0.31
1543,1543,1543,Study: Red Meat Takes Years Off Of Cow's Life ,studi red meat take year cow life,1,"[0.0, 1.0, 0.0, 0.0]",0,0.0,0.0,1.0,0.0
1544,1544,1544,"Mayor Hits On Crazy Idea Of Developing City’s Waterfront, Green Spaces ",mayor hit crazi idea develop citi waterfront green space,1,"[0.0, 1.0, 0.0, 0.0]",0,0.0,0.0,1.0,0.0
1545,1545,1545,National News Highlights: ,nation news highlight,1,"[0.0, 0.455, 0.545, 0.34]",1,0.34,0.0,0.455,0.545
1546,1546,1546,Alarming Study Finds 60% Of Americans Don’t Know Where Their Next Value Meal Going To Come From… ,alarm studi find american know next valu meal go come,1,"[0.211, 0.789, 0.0, -0.34]",0,-0.34,0.21100000000000002,0.789,0.0
1547,1547,1547,Trump Disapproval Rating At All-Time High #WhatDoYouThink? ,trump disapprov rate time high whatdoyouthink,1,"[0.0, 1.0, 0.0, 0.0]",0,0.0,0.0,1.0,0.0
1548,1548,1548,Literary Theorists Admit They Still Have No Idea What Animal Farm About ,literari theorist admit still idea anim farm,1,"[0.0, 0.769, 0.231, 0.2023]",0,0.2023,0.0,0.769,0.231
1549,1549,1549,"When I made the connection between the animals I often grilled in my backyard and the animal before me able to sco… 
Embarrassed Brett Kavanaugh Can’t Believe He Wore Handmaid Costume On Same Day As Protesters 
David Remnick Quietly Relieved He Won’t Have To Lose Debate To Steve Bannon In Front Of Everyone… 
Competitive Adidas Unveils Darren Wilson As New Face Of Brand 
Societal Collapse Narrowly Averted After Man Honks Horn At Car Paused At Green Light 
California Man Charged With Threatening To Kill ‘Boston Globe’ Employees #WhatDoYouThink? 
Your Horoscopes — Week Of September 4, 2018 
Coworkers Nationwide Embrace Tearfully After Painful 3-Day Separation 
First Day Of School Photos A Chance To See How Much Cousin’s Kids Are Chunking Out This Year 
Area Man Self-Conscious About All The Wrong Things 
Koch Brothers Encouraging Youth To Make Voices Heard By Registering Super PAC 
Some Guy At Bar Lived In San Francisco For A Summer And Liked It A Lot 
Top Benefits Of Compact Cars 
Man Just Waiting Tables Until Fundamental Structure Of U.S. Economy Changes 
National News Highlights 
4 Angels Banished From Heaven For Attempting To Unionize 
For more exemplary journalism, visit 
Potential Employee Uprising Quelled With Free Pizza 
Did You Know? 
Poll Finds Majority Of Americans Approve Of Child Labor Laws But Agree That Kids Carrying Briefcases Would Be Cute… 
Trail Of Ants Better Be Leading Toward Something Delicious 
Scientists Determine Tingling Sensation Of ASMR Caused By Mass Brain Cell Die-Off 
Timeline Of The U.S. Labor Movement 
Nation Baffled By Childless Woman Who Doesn’t Even Have High-Powered Career 
Americans Take Day Off From Looking For Work 
Alabama Begins Offering Tax Credit To Attract More YouTube Fail Compilations To Be Filmed In State… 
The Week In Pictures – Week Of September 3, 2018 
Secretary Of Labor Assures Nation There Still Plenty Of Jobs For Americans Willing To Outwork Robots… 
Report: Average American Worker Replaced Within 10 Minutes Of Taking Vacation 
Hero Firefighter Loses Lifelong Battle With Fire 
University Admits It Pretty Weird They Let Bunch Of 20-Year-Olds Live In Big Mansion And Torture Each Other… 
Man’s Body Running Out Of Ideas To Convince Him He Full 
Satan Refuses To Accept Any More Catholic Priests In Hell 
Friend’s Grandma To Give You Hug Too 
This Week's Editorial Cartoon: Flooding The Airwaves"" ",made connect anim often grill backyard anim abl sco embarrass brett kavanaugh believ wore handmaid costum day protest david remnick quiet reliev lose debat steve bannon front everyon competit adida unveil darren wilson new face brand societ collaps narrowli avert man honk horn car paus green light california man charg threaten kill boston globe employe whatdoyouthink horoscop week septemb cowork nationwid embrac tear pain day separ first day school photo chanc see much cousin kid chunk year area man self conscious wrong thing koch brother encourag youth make voic heard regist super pac guy bar live san francisco summer like lot top benefit compact car man wait tabl fundament structur u economi chang nation news highlight angel banish heaven attempt union exemplari journal visit potenti employe upris quell free pizza know poll find major american approv child labor law agre kid carri briefcas would cute trail ant better lead toward someth delici scientist determin tingl sensat asmr caus mass brain cell die timelin u labor movement nation baffl childless woman even high power career american take day look work alabama begin offer tax credit attract youtub fail compil film state week pictur week septemb secretari labor assur nation still plenti job american will outwork robot report averag american worker replac within minut take vacat hero firefight lose lifelong battl fire univers admit pretti weird let bunch year old live big mansion tortur man bodi run idea convinc full satan refus accept cathol priest hell friend grandma give hug week editori cartoon flood airwav,1,"[0.142, 0.711, 0.147, 0.128]",0,0.128,0.142,0.711,0.147
1550,1550,1550,"New Rec Room Has Everything A Teen Could Want, Reports Church Youth Pastor ",new rec room everyth teen could want report church youth pastor,1,"[0.0, 0.885, 0.115, 0.0772]",0,0.0772,0.0,0.885,0.115
1551,1551,1551,So-Called Professional Gamer Not Even Racist ,call profession gamer even racist,1,"[0.5, 0.5, 0.0, -0.6124]",0,-0.6124,0.5,0.5,0.0
1552,1552,1552,God Wondering How Far He Could Throw Earth ,god wonder far could throw earth,1,"[0.0, 0.704, 0.296, 0.2732]",0,0.2732,0.0,0.7040000000000001,0.29600000000000004
1553,1553,1553,Trump Revokes Puerto Rico Recovery Funds After Learning Hurricane Maria Had Fewer Survivors ,trump revok puerto rico recoveri fund learn hurrican maria fewer survivor,1,"[0.0, 0.8, 0.2, 0.3612]",0,0.3612,0.0,0.8,0.2
1554,1554,1554,"In Search Of A Better Life, Teen Moves Downstairs ",search better life teen move downstair,1,"[0.0, 0.633, 0.367, 0.4404]",0,0.4404,0.0,0.633,0.36700000000000005
1555,1555,1555,Dick Pulled Back Out Again ,dick pull back,1,"[0.623, 0.377, 0.0, -0.5106]",-1,-0.5106,0.623,0.377,0.0
1556,1556,1556,Best Man Has No Idea Why He Was Picked ,best man idea pick,1,"[0.0, 0.417, 0.583, 0.6369]",1,0.6369,0.0,0.41700000000000004,0.583
1557,1557,1557,Does Notre Dame’s Mascot Trivialize The Heartbreaking Genocide Of Leprechauns? ,notr dame mascot trivial heartbreak genocid leprechaun,1,"[0.49, 0.51, 0.0, -0.5859]",0,-0.5859,0.49,0.51,0.0
1558,1558,1558,Family Chooses Different Dog Than Reincarnated Grandfather ,famili choos differ dog reincarn grandfath,1,"[0.0, 1.0, 0.0, 0.0]",0,0.0,0.0,1.0,0.0
1559,1559,1559,NASCAR Race Stops To Wait For Family Of Ducks To Pass ,nascar race stop wait famili duck pas,1,"[0.268, 0.732, 0.0, -0.296]",0,-0.29600000000000004,0.268,0.732,0.0
1560,1560,1560,Poll: 89% Of Illegal Immigrants Would Prefer Path To Corporate Status ,poll illeg immigr would prefer path corpor status,1,"[0.0, 1.0, 0.0, 0.0]",0,0.0,0.0,1.0,0.0
1561,1561,1561,NRA Calls For Department Of Education To Provide Every Student With Body Bag ,nra call depart educ provid everi student bodi bag,1,"[0.0, 1.0, 0.0, 0.0]",0,0.0,0.0,1.0,0.0
1562,1562,1562,‘Better Homes & Gardens’ Puts First Plus-Sized Succulent On September Cover ,better home garden put first plus size succul septemb cover,1,"[0.0, 0.756, 0.244, 0.4404]",0,0.4404,0.0,0.7559999999999999,0.244
1563,1563,1563,Florida Passes Strict Ban On Being Unarmed ,florida pass strict ban unarm,1,"[0.474, 0.526, 0.0, -0.5574]",0,-0.5574,0.474,0.526,0.0
1564,1564,1564,"Dry Humping An Adequate Sex Alternative For Teens, Says Weird, Unsolicited Report From Department Of Interior… ",dri hump adequ sex altern teen say weird unsolicit report depart interior,1,"[0.134, 0.866, 0.0, -0.1779]",0,-0.1779,0.134,0.866,0.0
1565,1565,1565,"Area Woman's Type Tall, Athletic Men Who Have Already Hurt Her ",area woman type tall athlet men alreadi hurt,1,"[0.327, 0.673, 0.0, -0.5267]",0,-0.5267,0.327,0.6729999999999999,0.0
1566,1566,1566,Tips For Investing Your Money ,tip invest money,1,"[0.0, 1.0, 0.0, 0.0]",0,0.0,0.0,1.0,0.0
1567,1567,1567,Woman Fulfills Manifest Destiny Of Hardwood Floor Throughout Home ,woman fulfil manifest destini hardwood floor throughout home,1,"[0.0, 1.0, 0.0, 0.0]",0,0.0,0.0,1.0,0.0
1568,1568,1568,Friend's Excuses For Why He Can't Hang Out Getting More Sophisticated Over Time ,friend excus hang get sophist time,1,"[0.0, 0.61, 0.39, 0.4939]",0,0.4939,0.0,0.61,0.39
1569,1569,1569,"How does that make you feel? Pretty good, right? ",make feel pretti good right,1,"[0.0, 0.58, 0.42, 0.4404]",0,0.4404,0.0,0.58,0.42
1570,1570,1570,Report: 89% Of Americans Just Want To Go Home Right Now ,report american want go home right,1,"[0.0, 0.794, 0.206, 0.0772]",0,0.0772,0.0,0.794,0.20600000000000002
1571,1571,1571,Evolution Definitively Proven As Scientists Capture First-Ever Footage Of Chimpanzee Transforming Into Human… ,evolut definit proven scientist captur first ever footag chimpanze transform human,1,"[0.0, 1.0, 0.0, 0.0]",0,0.0,0.0,1.0,0.0
1572,1572,1572,Trump Disapproval Rating Reaches All-Time None Of This Matters ,trump disapprov rate reach time none matter,1,"[0.15, 0.697, 0.153, 0.0067]",0,0.0067,0.15,0.6970000000000001,0.153
1573,1573,1573,Trump Teeters On White House Ledge Weighing Pros And Cons Of Killing Self Right Now To Distract From McCain’s Funer… ,trump teeter white hous ledg weigh pro con kill self right distract mccain funer,1,"[0.365, 0.635, 0.0, -0.7845]",0,-0.7845,0.365,0.635,0.0
1574,1574,1574,Jeffrey Dahmer Estate Releases Collection Of Never-Before-Seen Victim Remains ,jeffrey dahmer estat releas collect never seen victim remain,1,"[0.0, 0.815, 0.185, 0.2057]",0,0.2057,0.0,0.815,0.185
1575,1575,1575,Eminem Horrified Upon Being Informed That ‘Faggot’ Actually A Harmful Gay Slur ,eminem horrifi upon inform faggot actual harm gay slur,1,"[0.53, 0.47, 0.0, -0.836]",-1,-0.836,0.53,0.47,0.0
1576,1576,1576,"Dad Just Wants Nice, Simple Xbox One For Checking Email ",dad want nice simpl xbox one check email,1,"[0.0, 0.594, 0.406, 0.4767]",0,0.4767,0.0,0.594,0.406
1577,1577,1577,Restaurant Entrance Doesn’t Work All Damn Day To Be Called ‘Other Door’ ,restaur entranc work damn day call door,1,"[0.31, 0.69, 0.0, -0.4019]",0,-0.4019,0.31,0.69,0.0
1578,1578,1578,Free Toothpick Transforms Schlubby Restaurant-Goer Into Aloof Bad Boy ,free toothpick transform schlubbi restaur goer aloof bad boy,1,"[0.254, 0.507, 0.239, -0.0516]",0,-0.0516,0.254,0.507,0.239
1579,1579,1579,Relationship Experts Recommend Telling Woman You Would Die For Her At Outset Of First Date ,relationship expert recommend tell woman would die outset first date,1,"[0.271, 0.556, 0.174, -0.34]",0,-0.34,0.271,0.556,0.174
1580,1580,1580,Timeline Of The American Education System ,timelin american educ system,1,"[0.0, 1.0, 0.0, 0.0]",0,0.0,0.0,1.0,0.0
1581,1581,1581,Report: High School Marching Band Definitely In Shape Of Something ,report high school march band definit shape someth,1,"[0.0, 1.0, 0.0, 0.0]",0,0.0,0.0,1.0,0.0
1582,1582,1582,Warden Scrambling To Find Ways To Punish Striking Inmates Worse Than Their Typical Living Conditions… ,warden scrambl find way punish strike inmat wors typic live condit,1,"[0.353, 0.647, 0.0, -0.5994]",0,-0.5994,0.353,0.647,0.0
1583,1583,1583,CDC Reports Surge In Sexually Transmitted Disease #WhatDoYouThink? ,cdc report surg sexual transmit diseas whatdoyouthink,1,"[0.0, 1.0, 0.0, 0.0]",0,0.0,0.0,1.0,0.0
1584,1584,1584,Teacher Asks Students To Split Into 2 Groups To Simulate Ideal Class Size ,teacher ask student split group simul ideal class size,1,"[0.0, 0.702, 0.298, 0.5267]",0,0.5267,0.0,0.7020000000000001,0.298
1585,1585,1585,Unpopular Police Officer Thinking About Committing Racially Motivated Offense For A Little Support… ,unpopular polic offic think commit racial motiv offens littl support,1,"[0.0, 0.62, 0.38, 0.5994]",0,0.5994,0.0,0.62,0.38
1586,1586,1586,Scientists Ask Congress To Fund $50 Billion Science Thing ,scientist ask congress fund billion scienc thing,1,"[0.0, 1.0, 0.0, 0.0]",0,0.0,0.0,1.0,0.0
1587,1587,1587,ISIS Operatives Destroy Hofner Bass Guitar Signed By Paul McCartney ,isi oper destroy hofner bass guitar sign paul mccartney,1,"[0.304, 0.696, 0.0, -0.5423]",0,-0.5423,0.304,0.696,0.0
1588,1588,1588,Full Summer Of Tending Backyard Garden Produces Single Edible Cherry Tomato ,full summer tend backyard garden produc singl edibl cherri tomato,1,"[0.0, 1.0, 0.0, 0.0]",0,0.0,0.0,1.0,0.0
1589,1589,1589,Great Villains In Cinema History ,great villain cinema histori,1,"[0.371, 0.206, 0.423, 0.128]",1,0.128,0.371,0.20600000000000002,0.423
1590,1590,1590,Driving Instructor Has Own Gas Pedal In Case Student Total Pussy ,drive instructor gas pedal case student total pussi,1,"[0.0, 1.0, 0.0, 0.0]",0,0.0,0.0,1.0,0.0
1591,1591,1591,Ron DeSantis Clarifies That ‘Monkey’ Comment Was Intended As Subtle Enough Dog Whistle To Get Away With… ,ron desanti clarifi monkey comment intend subtl enough dog whistl get away,1,"[0.0, 1.0, 0.0, 0.0]",0,0.0,0.0,1.0,0.0
1592,1592,1592,University Admits It Pretty Weird They Let Bunch Of 20-Year-Olds Live In Big Mansion And Torture Each Other… ,univers admit pretti weird let bunch year old live big mansion tortur,1,"[0.126, 0.741, 0.133, 0.0258]",0,0.0258,0.126,0.741,0.133
1593,1593,1593,"Eagles Hang Beer-Drenched, Charred Super Bowl Banner ",eagl hang beer drench char super bowl banner,1,"[0.0, 0.642, 0.358, 0.5994]",0,0.5994,0.0,0.642,0.358
1594,1594,1594,White House Counsel To Step Down In Fall #WhatDoYouThink? ,white hous counsel step fall whatdoyouthink,1,"[0.0, 1.0, 0.0, 0.0]",0,0.0,0.0,1.0,0.0
1595,1595,1595,Praying Mantis Hesitantly Agrees To Try Girlfriend’s Sexual Fantasy Of Eating His Head During Intercourse… ,pray manti hesit agre tri girlfriend sexual fantasi eat head intercours,1,"[0.0, 0.813, 0.187, 0.3182]",0,0.3182,0.0,0.813,0.187
1596,1596,1596,Political Scientists Reassure Americans That Stripping Minorities Of Citizenship Usually Where Descent Into Fascism… ,polit scientist reassur american strip minor citizenship usual descent fascism,1,"[0.0, 1.0, 0.0, 0.0]",0,0.0,0.0,1.0,0.0
1597,1597,1597,Ryan Zinke Calls For Legislation To Slow Down Destruction Of Wildlife So He Can Truly Savor Every Minute Of It… ,ryan zink call legisl slow destruct wildlif truli savor everi minut,1,"[0.254, 0.746, 0.0, -0.5267]",0,-0.5267,0.254,0.746,0.0
