,Unnamed: 0,Unnamed: 0.1,raw_text,clean,label,sentiment_vector,vader_polarity,sentiment_score,sentiment_0,sentiment_1,sentiment_2
825,825,825,"I’m really looking forward to improving the vitality of our caucus by spending lots of time with these new represe… 
Amazon Officially Picks New York, Northern Virginia For Next Headquarters #WhatDoYouThink? 
For the latest from the world’s most unstoppable media juggernaut, visit 
Boss Has Deft Touch For Making Employees Feel Like Shit 
Recently Divorced 40-Year-Old Struggling To Navigate College Dating Scene 
In Focus: Defiant Mitch McConnell Holds Merrick Garland’s Severed Head Aloft In Front Of Capitol Building… 
Melania Releases Statement Calling For Removal Of First Lady From White House 
Nation’s Tourists Announce Plans To Form Circle, Clap Hands Around Guys Doing Flips And Stuff… 
This Week's Editorial Cartoon: The Fantastic Bore"" ",realli look forward improv vital caucus spend lot time new repres amazon offici pick new york northern virginia next headquart whatdoyouthink latest world unstopp medium juggernaut visit bos deft touch make employe feel like shit recent divorc year old struggl navig colleg date scene focus defiant mitch mcconnel hold merrick garland sever head aloft front capitol build melania releas statement call remov first ladi white hous nation tourist announc plan form circl clap hand around guy flip stuff week editori cartoon fantast bore,1,"[0.081, 0.816, 0.103, 0.2732]",0,0.2732,0.081,0.816,0.10300000000000001
826,826,826,Female Director Asked If She Feels Comfortable Filming Scene While Nude ,femal director ask feel comfort film scene nude,1,"[0.0, 0.737, 0.263, 0.3612]",0,0.3612,0.0,0.737,0.263
827,827,827,Nancy Pelosi Planning To Reenergize House By Injecting Self With Blood Of Young Representatives… ,nanci pelosi plan reenerg hous inject self blood young repres,1,"[0.0, 1.0, 0.0, 0.0]",0,0.0,0.0,1.0,0.0
828,828,828,Naked Man Refusing To Let Unworthy Attire Touch His Body Until Launch Of New Onion Store Merchandise… ,nake man refus let unworthi attir touch bodi launch new onion store merchandis,1,"[0.0, 1.0, 0.0, 0.0]",0,0.0,0.0,1.0,0.0
829,829,829,Pfizer Unveils New Double-Sided EpiPen For Lovers ,pfizer unveil new doubl side epipen lover,1,"[0.0, 0.612, 0.388, 0.5859]",0,0.5859,0.0,0.612,0.38799999999999996
830,830,830,Report: Nation Getting Out All Its Aggression During Monthly Calls To Wireless Provider To Fix Service… ,report nation get aggress month call wireless provid fix servic,1,"[0.204, 0.796, 0.0, -0.3182]",0,-0.3182,0.204,0.7959999999999999,0.0
831,831,831,The Onion’s Guide To ‘Red Dead Redemption 2’ ,onion guid red dead redempt,1,"[0.518, 0.482, 0.0, -0.6486]",-1,-0.6486,0.518,0.48200000000000004,0.0
832,832,832,North Korea Possibly Still Operating Hidden Missiles Bases #WhatDoYouThink? ,north korea possibl still oper hidden missil base whatdoyouthink,1,"[0.0, 1.0, 0.0, 0.0]",0,0.0,0.0,1.0,0.0
833,833,833,Unclear What Coworker With Banana On Desk All Day Waiting For ,unclear cowork banana desk day wait,1,"[0.286, 0.714, 0.0, -0.25]",0,-0.25,0.28600000000000003,0.7140000000000001,0.0
834,834,834,BREAKING: Mrs. Nichols Also Daniel’s Mom ,break mr nichol also daniel mom,1,"[0.0, 1.0, 0.0, 0.0]",0,0.0,0.0,1.0,0.0
835,835,835,Paleontologists Determine Dinosaurs Were Killed By Someone They Trusted ,paleontologist determin dinosaur kill someon trust,1,"[0.392, 0.333, 0.275, -0.34]",-1,-0.34,0.392,0.33299999999999996,0.275
836,836,836,Elderly Man Hailed As Alert ,elder man hail alert,1,"[0.0, 0.364, 0.636, 0.3612]",1,0.3612,0.0,0.364,0.636
837,837,837,Man On Internet Almost Falls Into World Of DIY Mustard Enthusiasts ,man internet almost fall world diy mustard enthusiast,1,"[0.0, 0.737, 0.263, 0.3612]",0,0.3612,0.0,0.737,0.263
838,838,838,"If you enter a subway station and cannot prove you work for Jeff Bezos, you will be arrested. ",enter subway station prove work jeff bezo arrest,1,"[0.255, 0.745, 0.0, -0.34]",0,-0.34,0.255,0.745,0.0
839,839,839,Businessman Does His Work Lying On Bed Like Schoolgirl ,businessman work lie bed like schoolgirl,1,"[0.0, 0.667, 0.333, 0.3612]",0,0.3612,0.0,0.667,0.33299999999999996
840,840,840,Serial Killer Makes Impassioned Case For Protecting Local Marsh ,serial killer make impass case protect local marsh,1,"[0.333, 0.465, 0.202, -0.4019]",0,-0.4019,0.33299999999999996,0.465,0.20199999999999999
841,841,841,5 Things To Know About ‘Fantastic Beasts: The Crimes Of Grindelwald’ ,thing know fantast beast crime grindelwald,1,"[0.412, 0.588, 0.0, -0.5423]",0,-0.5423,0.41200000000000003,0.588,0.0
842,842,842,"‘You Are All Inside Amazon’s Second Headquarters,’ Jeff Bezos Announces To Horrified Americans As Massive Dome Enve… ",insid amazon second headquart jeff bezo announc horrifi american massiv dome env,1,"[0.0, 0.866, 0.134, 0.1779]",0,0.1779,0.0,0.866,0.134
843,843,843,Poll Finds Voters Don't Support Impeaching Trump #WhatDoYouThink? ,poll find voter support impeach trump whatdoyouthink,1,"[0.0, 0.69, 0.31, 0.4019]",0,0.4019,0.0,0.69,0.31
844,844,844,NRA Publishes Tips For Staying Safe While Committing A Mass Shooting ,nra publish tip stay safe commit mass shoot,1,"[0.192, 0.4, 0.408, 0.4019]",1,0.4019,0.192,0.4,0.408
845,845,845,Surgeon General Confirms A Bit Of Blow Here And There Won’t Kill Ya ,surgeon general confirm bit blow kill ya,1,"[0.439, 0.561, 0.0, -0.6908]",0,-0.6908,0.439,0.561,0.0
846,846,846,"‘He’s Not Right For You,’ Report Relationship Experts Who Must Not Want To See You Be Happy ",right report relationship expert must want see happi,1,"[0.0, 0.843, 0.157, 0.0772]",0,0.0772,0.0,0.843,0.157
847,847,847,Trump Delivers Touching Tribute To Fallen Heroes Of WWE ,trump deliv touch tribut fallen hero wwe,1,"[0.225, 0.45, 0.324, 0.2732]",0,0.2732,0.225,0.45,0.324
848,848,848,Political Ad Spending Hit New Record In 2018 Midterms #WhatDoYouThink? ,polit ad spend hit new record midterm whatdoyouthink,1,"[0.0, 1.0, 0.0, 0.0]",0,0.0,0.0,1.0,0.0
849,849,849,45-Year-Old Loser Moves In With Parents ,year old loser move parent,1,"[0.459, 0.541, 0.0, -0.5267]",0,-0.5267,0.45899999999999996,0.541,0.0
850,850,850,"Your Horoscopes — Week Of November 13, 2018 ",horoscop week novemb,1,"[0.0, 1.0, 0.0, 0.0]",0,0.0,0.0,1.0,0.0
851,851,851,Less Popular Friend Proposes Combining Birthdays Into Single Party ,le popular friend propos combin birthday singl parti,1,"[0.0, 0.5, 0.5, 0.7184]",0,0.7184,0.0,0.5,0.5
852,852,852,Police Department Deploys Fancyclothes Cop ,polic depart deploy fancycloth cop,1,"[0.0, 1.0, 0.0, 0.0]",0,0.0,0.0,1.0,0.0
853,853,853,Man Trying To Get Out Of Executioner Duty ,man tri get execution duti,1,"[0.0, 1.0, 0.0, 0.0]",0,0.0,0.0,1.0,0.0
854,854,854,Escaped Caterpillar On Rampage Through City ,escap caterpillar rampag citi,1,"[0.0, 1.0, 0.0, 0.0]",0,0.0,0.0,1.0,0.0
855,855,855,Roommates Assured Girlfriend Only Staying Over For Entire Duration Of Relationship ,roommat assur girlfriend stay entir durat relationship,1,"[0.0, 1.0, 0.0, 0.0]",0,0.0,0.0,1.0,0.0
856,856,856,Tips For Overcoming A Panic Attack ,tip overcom panic attack,1,"[0.762, 0.238, 0.0, -0.7506]",-1,-0.7506,0.762,0.23800000000000002,0.0
857,857,857,3 More States Vote To Legalize Marijuana #WhatDoYouThink? ,state vote legal marijuana whatdoyouthink,1,"[0.0, 0.727, 0.273, 0.128]",0,0.128,0.0,0.727,0.273
858,858,858,"Legend has it that this land is home to a lost race of people living in complete isolation, and if I can manage to… 
National News Highlights 
Area Man Makes It Through Day 
Woman Confident She Has The Safety Net It Takes To Achieve Dreams 
Emmanuel Macron Calls For ‘True European Army’ Against U.S., Chinese Threats 
FEMA Assures Wildfire Victims Bucket Brigade Nearly Over Maryland State Line 
Supposed ‘Game Of Thrones’ Buff Hasn’t Even Finished Books Yet 
Study Finds Only 20% Of Seminary Graduates Go On To Become God 
Family Figures Grandpa Never Talks About WWII Because Nothing Interesting Happened To Him 
Stan Lee, Creator Of Beloved Marvel Character Stan Lee, Dead At 95 
Friends Excitedly Gather Around Man’s Phone To Watch Shaky Footage Of Concert 
For more exemplary journalism, visit 
Kid Diving Into Pile Of Leaves Has No Idea There Homeless Guy Jerking Off In There 
Researchers Find Decline In Facebook Use Could Be Directly Linked To Desire To Be Happy, Fully Functioning Person… 
Trump Hacks Through Thick Central American Jungle In Search Of Entirely New Ethnic Group To Demonize… 
Unattractive Man Not Fooling Anyone By Dressing Well 
Ecologists Discover 400 Species Of Charles Darwin Living In Galápagos Islands 
Report Finds Children Of Parents Often Become Parents Themselves 
The Week In Pictures – Week Of November 12, 2018 
Ruth Bader Ginsburg Debating Whether To Cancel Winter Vacation Climbing K2 
Lack Of Sexual Tension With Coworker Almost Unbearable 
‘We’ll Be Moving Shortly,’ Says Train Conductor Waiting For Workers To Remove Dead Body From Tracks… 
Generous Military Sends $800 In Disability To Man Who Wakes Up Screaming Every Night 
Anguished, Screaming Trump Bans Father’s Ghost From Press Room For Silently Pointing At Him 
Town Nervously Welcomes Veteran Back Home 
Is Cindy Gruden Worth More Than The 7th-Round Pick Jon Gruden Traded Her For? 
Stadium Crowd Unsure When It Okay To Sit After Honoring WWII Veteran 
Mueller Wondering Why There All This Drama Over Trump’s Unpaid Parking Violations 
Afghanistan War Veteran Solemnly Recalls Seeing Entire Platoon Killed By Undiagnosed PTSD 
Should Dunkin’ Donuts End Its Promotion With The NFL That Gives Fans One Free Medium Coffee For Every First Down? 
This Weekend's Onion Magazine: 
World War II Hero Cursed Out For Driving Speed Limit 
Trump Unveils Reelection Campaign Plan To Drive Bus Into Crowds Across Country 
Mom Just Wants To Watch Something Nice 
MIT Scientists Create Robot Capable Of Feeling Lust 
More Elderly Americans Keeping Active By Maintaining Control Of Senate 
Local Water Tower Celebrates 50th Year As Repository Of Information On Who Is A Slut 
This Week's Editorial Cartoon: Buy Partisan"" ",legend land home lost race peopl live complet isol manag nation news highlight area man make day woman confid safeti net take achiev dream emmanuel macron call true european armi u chines threat fema assur wildfir victim bucket brigad near maryland state line suppos game throne buff even finish book yet studi find seminari graduat go becom god famili figur grandpa never talk wwii noth interest happen stan lee creator belov marvel charact stan lee dead friend excit gather around man phone watch shaki footag concert exemplari journal visit kid dive pile leaf idea homeless guy jerk research find declin facebook use could direct link desir happi fulli function person trump hack thick central american jungl search entir new ethnic group demon unattract man fool anyon dress well ecologist discov speci charl darwin live gal pago island report find child parent often becom parent week pictur week novemb ruth bader ginsburg debat whether cancel winter vacat climb k lack sexual tension cowork almost unbear move short say train conductor wait worker remov dead bodi track generous militari send disabl man wake scream everi night anguish scream trump ban father ghost press room silent point town nervous welcom veteran back home cindi gruden worth th round pick jon gruden trade stadium crowd unsur okay sit honor wwii veteran mueller wonder drama trump unpaid park violat afghanistan war veteran solemn recal see entir platoon kill undiagnos ptsd dunkin donut end promot nfl give fan one free medium coffe everi first weekend onion magazin world war ii hero curs drive speed limit trump unveil reelect campaign plan drive bus crowd across countri mom want watch someth nice mit scientist creat robot capabl feel lust elder american keep activ maintain control senat local water tower celebr th year repositori inform slut week editori cartoon buy partisan,1,"[0.171, 0.71, 0.119, -0.969]",0,-0.9690000000000001,0.171,0.71,0.11900000000000001
859,859,859,Girlfriend To Stay Underneath Blanket For Next 5 Months ,girlfriend stay underneath blanket next month,1,"[0.0, 1.0, 0.0, 0.0]",0,0.0,0.0,1.0,0.0
860,860,860,Americans Demand Their Voices Be Heard And Also Some Kind Of Dessert You Get After Breakfast ,american demand voic heard also kind dessert get breakfast,1,"[0.126, 0.588, 0.286, 0.4404]",0,0.4404,0.126,0.588,0.28600000000000003
861,861,861,"Career Spider Not Sure She's Ready For 3,000 Children At This Point ",career spider sure readi child point,1,"[0.0, 0.685, 0.315, 0.3182]",0,0.3182,0.0,0.685,0.315
862,862,862,"We’ve confirmed that there will also be one with a really pretty scalloped edge, one with a big hole in the middle… 
Lonely Nation Gathers Outside Window Of Happy Family Eating Dinner Together 
National News Highlights 
Community Theater Gives Part Of Blanche DuBois To Kathy Fucking Hamilton 
Our study confirms that a diet rich in foods such as olive oil, fish, and green vegetables can extend one’s lifesp… ",confirm also one realli pretti scallop edg one big hole middl lone nation gather outsid window happi famili eat dinner togeth nation news highlight communiti theater give part blanch duboi kathi fuck hamilton studi confirm diet rich food oliv oil fish green veget extend one lifesp,1,"[0.103, 0.755, 0.142, 0.2732]",0,0.2732,0.10300000000000001,0.755,0.142
863,863,863,Aisle Of Hispanic Food Items All Man Needs To Know About Fate Of Country ,aisl hispan food item man need know fate countri,1,"[0.0, 1.0, 0.0, 0.0]",0,0.0,0.0,1.0,0.0
864,864,864,Man’s Ironclad Grasp Of Issue Can Withstand 2 Follow-Up Questions ,man ironclad grasp issu withstand follow question,1,"[0.0, 1.0, 0.0, 0.0]",0,0.0,0.0,1.0,0.0
865,865,865,Record Number Of Women To Take Seats In Congress #WhatDoYouThink? ,record number woman take seat congress whatdoyouthink,1,"[0.0, 0.822, 0.178, 0.0772]",0,0.0772,0.0,0.8220000000000001,0.17800000000000002
866,866,866,Reddi-Wip Casually Announces Their Nozzles Can Easily Fit Into Most Orifices ,reddi wip casual announc nozzl easili fit orific,1,"[0.0, 0.583, 0.417, 0.5106]",0,0.5106,0.0,0.583,0.41700000000000004
867,867,867,"City Officials Warn Against Flushing Feminine Hygiene Products After Finding 8-Foot-Long, 250-Pound Tampon Lurking… ",citi offici warn flush feminin hygien product find foot long pound tampon lurk,1,"[0.225, 0.775, 0.0, -0.296]",0,-0.29600000000000004,0.225,0.775,0.0
868,868,868,"Study Finds Mediterranean Diet Adds Years To Your Life, But Only By Taking Them Away From Others… ",studi find mediterranean diet add year life take away other,1,"[0.0, 1.0, 0.0, 0.0]",0,0.0,0.0,1.0,0.0
869,869,869,Georgia GOP Demands Stacey Abrams Step Down As Candidate To Avoid Conflict Of Interest ,georgia gop demand stacey abram step candid avoid conflict interest,1,"[0.4, 0.4, 0.2, -0.25]",0,-0.25,0.4,0.4,0.2
870,870,870,Michelle Obama Admits Barack Had Way Too Much Sperm To Make Natural Conception Possible ,michell obama admit barack way much sperm make natur concept possibl,1,"[0.0, 0.847, 0.153, 0.2023]",0,0.2023,0.0,0.847,0.153
871,871,871,Tips For Ending A Friendship ,tip end friendship,1,"[0.0, 0.408, 0.592, 0.4404]",1,0.4404,0.0,0.408,0.5920000000000001
872,872,872,Astronomers Confirm Moon Will Have Dozens Of New Phases In 2019 ,astronom confirm moon dozen new phase,1,"[0.0, 1.0, 0.0, 0.0]",0,0.0,0.0,1.0,0.0
873,873,873,Is Cindy Gruden Worth More Than The 7th-Round Pick Jon Gruden Traded Her For? ,cindi gruden worth th round pick jon gruden trade,1,"[0.0, 0.808, 0.192, 0.2263]",0,0.2263,0.0,0.8079999999999999,0.192
874,874,874,"Trump Says He Hopes To Work With Democrats On Infrastructure, Drug Pricing #WhatDoYouThink? ",trump say hope work democrat infrastructur drug price whatdoyouthink,1,"[0.0, 0.734, 0.266, 0.4404]",0,0.4404,0.0,0.7340000000000001,0.266
875,875,875,"Report: Distracted Driving Results In More Than 5,000 Unfinished Texts Each Year ",report distract drive result unfinish text year,1,"[0.268, 0.732, 0.0, -0.296]",0,-0.29600000000000004,0.268,0.732,0.0
876,876,876,American People Hire High-Powered Lobbyist To Push Interests In Congress ,american peopl hire high power lobbyist push interest congress,1,"[0.0, 0.727, 0.273, 0.4588]",0,0.4588,0.0,0.727,0.273
877,877,877,Study Finds Hearing Loved One's Voice Induces Excruciating Pain In Coma Patients ,studi find hear love one voic induc excruci pain coma patient,1,"[0.2, 0.545, 0.255, 0.2263]",0,0.2263,0.2,0.545,0.255
878,878,878,"Dream About You Not Sexual, Coworker Reports ",dream sexual cowork report,1,"[0.0, 0.6, 0.4, 0.25]",0,0.25,0.0,0.6,0.4
879,879,879,Radiator Saving Single Loudest Clank For 3:32 A.M. ,radiat save singl loudest clank,1,"[0.0, 0.556, 0.444, 0.4939]",0,0.4939,0.0,0.556,0.444
880,880,880,"President Trump expects and even demands difficult questions from journalists, but for Acosta to infiltrate a hosp… 
Benefits Of Keeping A Journal 
Study Finds 60% Of Parents Too Busy With Divorce To Worry About Football Safety 
.@Acosta: Sir, you’re on record stating that—sir! Sir! Let me finish—you’re on record stating that you wanted to u… ",presid trump expect even demand difficult question journalist acosta infiltr hosp benefit keep journal studi find parent busi divorc worri footbal safeti acosta sir record state sir sir let finish record state want u,1,"[0.107, 0.777, 0.115, 0.0772]",0,0.0772,0.107,0.777,0.115
881,881,881,Red Sox Take Out Full-Page Ad In 'New York Times' Reminding City They Won World Series ,red sox take full page ad new york time remind citi world seri,1,"[0.0, 1.0, 0.0, 0.0]",0,0.0,0.0,1.0,0.0
882,882,882,Mueller Annoyed By Dipshit Protestors Holding Up Traffic During Commute ,mueller annoy dipshit protestor hold traffic commut,1,"[0.545, 0.455, 0.0, -0.7184]",-1,-0.7184,0.545,0.455,0.0
883,883,883,Chris Collins Thanks Supporters With Can't-Miss Tip On Biotech Stock ,chris collin thank support miss tip biotech stock,1,"[0.136, 0.424, 0.441, 0.5574]",1,0.5574,0.136,0.424,0.441
884,884,884,Jeff Sessions Forced Out As Attorney General #WhatDoYouThink? ,jeff session forc attorney general whatdoyouthink,1,"[0.0, 1.0, 0.0, 0.0]",0,0.0,0.0,1.0,0.0
885,885,885,Department Of Interior Reopens National Parks After Filling In All Canyons Posing Hazardous Fall Risk To Visitors… ,depart interior reopen nation park fill canyon pose hazard fall risk visitor,1,"[0.16, 0.84, 0.0, -0.2732]",0,-0.2732,0.16,0.84,0.0
886,886,886,Frustrated Nursing Student Unable To Draw Blood Without Draining Entire Body ,frustrat nurs student unabl draw blood without drain entir bodi,1,"[0.0, 1.0, 0.0, 0.0]",0,0.0,0.0,1.0,0.0
887,887,887,Dunkin’ Donuts Unveils New Seasonal Rotting Jack-O’-Lantern Latte For End Of Fall ,dunkin donut unveil new season rot jack lantern latt end fall,1,"[0.0, 1.0, 0.0, 0.0]",0,0.0,0.0,1.0,0.0
888,888,888,"‘Sir, You Stated You Wanted To Modernize The Grinch For Today’s Audience,’ Says New CNN Entertainment Reporter Jim… ",sir state want modern grinch today audienc say new cnn entertain report jim,1,"[0.0, 0.753, 0.247, 0.3818]",0,0.3818,0.0,0.753,0.247
889,889,889,"Anguished, Screaming Trump Bans Father’s Ghost From Press Room For Silently Pointing At Him ",anguish scream trump ban father ghost press room silent point,1,"[0.676, 0.324, 0.0, -0.91]",-1,-0.91,0.6759999999999999,0.324,0.0
890,890,890,Mueller Wondering Why There All This Drama Over Trump’s Unpaid Parking Violations ,mueller wonder drama trump unpaid park violat,1,"[0.0, 1.0, 0.0, 0.0]",0,0.0,0.0,1.0,0.0
891,891,891,Uber Driver Wants You To Know That Lots Of Mexicans Live In This Neighborhood ,uber driver want know lot mexican live neighborhood,1,"[0.0, 0.816, 0.184, 0.1477]",0,0.1477,0.0,0.816,0.184
892,892,892,Sick Parent Offers Man Perfect Excuse To Move Back Home And Give Up Dreams ,sick parent offer man perfect excus move back home give dream,1,"[0.194, 0.471, 0.335, 0.34]",0,0.34,0.19399999999999998,0.47100000000000003,0.335
893,893,893,Idris Elba Named Sexiest Man Alive #WhatDoYouThink? ,idri elba name sexiest man aliv whatdoyouthink,1,"[0.0, 1.0, 0.0, 0.0]",0,0.0,0.0,1.0,0.0
894,894,894,"‘No Way To Prevent This,’ Says Only Nation Where This Regularly Happens ",way prevent say nation regular happen,1,"[0.0, 0.82, 0.18, 0.0258]",0,0.0258,0.0,0.82,0.18
895,895,895,"‘Is It Too Late To Audition?’ Asks Perfect Actor For Role, Poking Head Into Room Just As Producers Were Giving Up H… ",late audit ask perfect actor role poke head room produc give h,1,"[0.0, 0.73, 0.27, 0.5719]",0,0.5719,0.0,0.73,0.27
896,896,896,Man Dying From Cancer Spends Last Good Day On Phone With Insurance Company ,man die cancer spend last good day phone insur compani,1,"[0.456, 0.385, 0.159, -0.7506]",-1,-0.7506,0.456,0.385,0.159
897,897,897,City Adds Some Big Concrete Stairs ,citi add big concret stair,1,"[0.0, 1.0, 0.0, 0.0]",0,0.0,0.0,1.0,0.0
898,898,898,Today's Weather Report ,today weather report,1,"[0.0, 1.0, 0.0, 0.0]",0,0.0,0.0,1.0,0.0
899,899,899,Lead designer Christian Cantamessa revealed that players can now control their horse directly while walking around… ,lead design christian cantamessa reveal player control hors direct walk around,1,"[0.0, 1.0, 0.0, 0.0]",0,0.0,0.0,1.0,0.0
900,900,900,Middle-Aged Man Having Best Snacks Of His Life ,middl age man best snack life,1,"[0.0, 0.543, 0.457, 0.6369]",0,0.6369,0.0,0.5429999999999999,0.457
901,901,901,Sick Fucks Line Up To Gape At Dead Body ,sick fuck line gape dead bodi,1,"[0.787, 0.213, 0.0, -0.9022]",-1,-0.9022,0.787,0.213,0.0
902,902,902,"Tech Is The Future, Reports Local Dad ",tech futur report local dad,1,"[0.0, 1.0, 0.0, 0.0]",0,0.0,0.0,1.0,0.0
903,903,903,Man Spends Whole Day Dreading Fun Activity He Signed Up For ,man spend whole day dread fun activ sign,1,"[0.244, 0.488, 0.268, 0.0772]",0,0.0772,0.244,0.488,0.268
904,904,904,Sessions: ‘I Am Proud To Have Served White America’ ,session proud serv white america,1,"[0.0, 0.563, 0.437, 0.4767]",0,0.4767,0.0,0.563,0.43700000000000006
905,905,905,Beto Voter Struggling To Refocus Her Sexual Fantasies On Ted Cruz ,beto voter struggl refocus sexual fantasi ted cruz,1,"[0.0, 1.0, 0.0, 0.0]",0,0.0,0.0,1.0,0.0
906,906,906,Inconsolable Jeff Sessions Tries To Commit Suicide By Smoking Joint ,inconsol jeff session tri commit suicid smoke joint,1,"[0.0, 0.761, 0.239, 0.296]",0,0.29600000000000004,0.0,0.7609999999999999,0.239
907,907,907,Democrats Win House #WhatDoYouThink? ,democrat win hous whatdoyouthink,1,"[0.0, 0.441, 0.559, 0.5859]",1,0.5859,0.0,0.441,0.5589999999999999
908,908,908,Pistachio-Eating Man Achieves ‘Flow’ State ,pistachio eat man achiev flow state,1,"[0.0, 1.0, 0.0, 0.0]",0,0.0,0.0,1.0,0.0
909,909,909,Nonprofit Places Burnouts In Jobs You Can Do Blitzed Out Of Your Mind ,nonprofit place burnout job blitz mind,1,"[0.0, 1.0, 0.0, 0.0]",0,0.0,0.0,1.0,0.0
910,910,910,Report: More Prisons Now Encouraging Inmates To Explore Their Creativity By Designing Own Method Of Execution… ,report prison encourag inmat explor creativ design method execut,1,"[0.292, 0.708, 0.0, -0.5106]",0,-0.5106,0.292,0.708,0.0
911,911,911,Key Takeaways From The 2018 Midterms ,key takeaway midterm,1,"[0.0, 1.0, 0.0, 0.0]",0,0.0,0.0,1.0,0.0
912,912,912,Report Finds J. Geils Band’s ‘Centerfold’ Will Outlast You And All That You Create In This Life… ,report find j geil band centerfold outlast creat life,1,"[0.0, 1.0, 0.0, 0.0]",0,0.0,0.0,1.0,0.0
913,913,913,Trump Unveils Reelection Campaign Plan To Drive Bus Into Crowds Across Country ,trump unveil reelect campaign plan drive bus crowd across countri,1,"[0.0, 1.0, 0.0, 0.0]",0,0.0,0.0,1.0,0.0
914,914,914,Upcoming ‘Red Dead Redemption 2’ Expansion Allows Players To Experience Story From Horse’s Perspective… ,upcom red dead redempt expans allow player experi stori hors perspect,1,"[0.283, 0.592, 0.125, -0.5267]",0,-0.5267,0.28300000000000003,0.5920000000000001,0.125
915,915,915,Kushner Assures Worried Ivanka They’d Definitely Be Last Jews To Go ,kushner assur worri ivanka definit last jew go,1,"[0.0, 1.0, 0.0, 0.0]",0,0.0,0.0,1.0,0.0
916,916,916,Backpedaling Trump Claims Eldest Son Would Probably Be Fine Doing 5 To 10 Years In Prison ,backped trump claim eldest son would probabl fine year prison,1,"[0.252, 0.611, 0.137, -0.3612]",0,-0.3612,0.252,0.611,0.13699999999999998
917,917,917,Bored J.B. Pritzker Brainstorming New Hobbies To Blow Money On After Winning Election ,bore j b pritzker brainstorm new hobbi blow money win elect,1,"[0.156, 0.547, 0.297, 0.4215]",0,0.4215,0.156,0.547,0.297
918,918,918,"Report: Wealth Of America’s 3 Richest Families Grew By 6,000% Since 1982 #WhatDoYouThink? ",report wealth america richest famili grew sinc whatdoyouthink,1,"[0.0, 0.476, 0.524, 0.765]",1,0.765,0.0,0.47600000000000003,0.524
919,919,919,More Elderly Americans Keeping Active By Maintaining Control Of Senate ,elder american keep activ maintain control senat,1,"[0.0, 1.0, 0.0, 0.0]",0,0.0,0.0,1.0,0.0
920,920,920,Capitol Building Dome Deflates ,capitol build dome deflat,1,"[0.0, 1.0, 0.0, 0.0]",0,0.0,0.0,1.0,0.0
921,921,921,Manager Slits Own Throat After Realizing Some Members Of Company Not On Same Page ,manag slit throat realiz member compani page,1,"[0.0, 1.0, 0.0, 0.0]",0,0.0,0.0,1.0,0.0
922,922,922,Area Woman Almost Imagines Taste Of Peppermint Mocha On Tongue But Stops Herself ,area woman almost imago tast peppermint mocha tongu stop,1,"[0.216, 0.784, 0.0, -0.296]",0,-0.29600000000000004,0.21600000000000003,0.784,0.0
923,923,923,Cockroaches Feeling Very Optimistic About Future Of Planet ,cockroach feel optimist futur planet,1,"[0.0, 0.541, 0.459, 0.5267]",0,0.5267,0.0,0.541,0.45899999999999996
924,924,924,White House Lawn Covered In Congressional Campaign Signs ,white hous lawn cover congression campaign sign,1,"[0.0, 1.0, 0.0, 0.0]",0,0.0,0.0,1.0,0.0
