,Unnamed: 0,Unnamed: 0.1,raw_text,clean,label,sentiment_vector,vader_polarity,sentiment_score,sentiment_0,sentiment_1,sentiment_2
2378,2378,2378,Police threatened to arrest Alex Jones for ruckus caused outside Google CEO 'conservative bias' hearing,polic threaten arrest alex jone ruckus caus outsid googl ceo conserv bias hear,4,"[0.39, 0.61, 0.0, -0.6597]",0,-0.6597,0.39,0.61,0.0
2379,2379,2379,Councils 'failing' to prosecute blue badge abusers,council fail prosecut blue badg abus,4,"[0.412, 0.588, 0.0, -0.5423]",0,-0.5423,0.41200000000000003,0.588,0.0
2380,2380,2380,"Is #MeToo helping women in the workplace, or undermining the presumption of innocence? In 2018 on ""The Economist as…",metoo help woman workplac undermin presumpt innoc economist,4,"[0.0, 0.722, 0.278, 0.4019]",0,0.4019,0.0,0.722,0.278
2381,2381,2381,Locals blame mainlanders for pushing up house prices and taking school places; spreading bad manners such as spitti…,local blame mainland push hous price take school place spread bad manner spitti,4,"[0.349, 0.651, 0.0, -0.7096]",0,-0.7096,0.349,0.6509999999999999,0.0
2382,2382,2382,"Democrats in control of the House should hold Mr Trump to account, but be careful not to serve as props in his perm…",democrat control hous hold mr trump account care serv prop perm,4,"[0.0, 0.758, 0.242, 0.4939]",0,0.4939,0.0,0.758,0.242
2383,2383,2383,"On today's special Swamp Edition of The News and Why It Matters, @SaraGonzalesTX, @MillerStream, @JesseKellyDC, and…",today special swamp edit news matter saragonzalestx millerstream jessekellydc,4,"[0.0, 0.648, 0.352, 0.4215]",0,0.4215,0.0,0.648,0.35200000000000004
2384,2384,2384,"Wow, what a statement",wow statement,4,"[0.0, 0.208, 0.792, 0.5859]",1,0.5859,0.0,0.20800000000000002,0.792
2385,2385,2385,"Venezuela, which has been in freefall for years, is forecast to be the worst-performing economy in 2019",venezuela freefal year forecast worst perform economi,4,"[0.406, 0.594, 0.0, -0.6249]",0,-0.6249,0.406,0.594,0.0
2386,2386,2386,NPR poll warns Democrats: Most Americans against US becoming more politically correct,npr poll warn democrat american u becom polit correct,4,"[0.167, 0.833, 0.0, -0.1027]",0,-0.1027,0.16699999999999998,0.833,0.0
2387,2387,2387,Police: Pennsylvania woman says she drove down railroad tracks because of GPS instructions,polic pennsylvania woman say drove railroad track gps instruct,4,"[0.0, 1.0, 0.0, 0.0]",0,0.0,0.0,1.0,0.0
2388,2388,2388,Hate to break it to you: that isn’t love 😬,hate break love,4,"[0.416, 0.112, 0.472, 0.128]",1,0.128,0.41600000000000004,0.11199999999999999,0.47200000000000003
2389,2389,2389,Mourne Mountains: Two walkers die in separate falls,mourn mountain two walker die separ fall,4,"[0.573, 0.427, 0.0, -0.7717]",-1,-0.7717,0.573,0.42700000000000005,0.0
2390,2390,2390,Journalist loses his job over this horrible tweet he posted against MAGA hat teens smeared by the media,journalist lose job horribl tweet post maga hat teen smear medium,4,"[0.366, 0.634, 0.0, -0.6369]",0,-0.6369,0.366,0.634,0.0
2391,2391,2391,Twitter name change viewed as another hint Elizabeth Warren could run for president in 2020,twitter name chang view anoth hint elizabeth warren could run presid,4,"[0.0, 1.0, 0.0, 0.0]",0,0.0,0.0,1.0,0.0
2392,2392,2392,The holiday village run by spies,holiday villag run spi,4,"[0.0, 0.526, 0.474, 0.4019]",0,0.4019,0.0,0.526,0.474
2393,2393,2393,Interesting.,interest,4,"[0.0, 0.0, 1.0, 0.4588]",1,0.4588,0.0,0.0,1.0
2394,2394,2394,Okay. What is it when American citizens are killed by illegal immigrants?,okay american citizen kill illeg immigr,4,"[0.443, 0.377, 0.179, -0.5859]",-1,-0.5859,0.44299999999999995,0.377,0.179
2395,2395,2395,Four 'seriously injured' in Nottinghamshire fire,four serious injur nottinghamshir fire,4,"[0.552, 0.448, 0.0, -0.4019]",-1,-0.4019,0.552,0.44799999999999995,0.0
2396,2396,2396,DeMarcus Cousins is unlikely to be the Golden State Warriors’ silver bullet,demarcus cousin unlik golden state warrior silver bullet,4,"[0.0, 1.0, 0.0, 0.0]",0,0.0,0.0,1.0,0.0
2397,2397,2397,Egypt 'recovers smuggled artefact' from UK auction,egypt recov smuggl artefact uk auction,4,"[0.0, 1.0, 0.0, 0.0]",0,0.0,0.0,1.0,0.0
2398,2398,2398,Liberals need to spend less time dismissing their critics as fools and bigots and more fixing what is wrong,liber need spend le time dismiss critic fool bigot fix wrong,4,"[0.503, 0.497, 0.0, -0.7964]",-1,-0.7964,0.503,0.49700000000000005,0.0
2399,2399,2399,RT @BBCPolitics: ⬆️ Brexit ⬆️ Social media ⬇️ Recession ⬇️ Afghanistan The words falling in and out of fashion with MPs,rt bbcpolit brexit social medium recess afghanistan word fall fashion mp,4,"[0.0, 1.0, 0.0, 0.0]",0,0.0,0.0,1.0,0.0
2400,2400,2400,Nearly all roads in Europe are named after men. Campaigners want to change that. Listen to this and more of our top…,near road europ name men campaign want chang listen top,4,"[0.0, 0.721, 0.279, 0.2732]",0,0.2732,0.0,0.721,0.27899999999999997
2401,2401,2401,"RT @BBCPolitics: Jeremy Corbyn attacks ""incompetence"" of Theresa May's government, saying if she loses #Brexit vote tomorrow, ""it's time fo…",rt bbcpolit jeremi corbyn attack incompet theresa may govern say lose brexit vote tomorrow time fo,4,"[0.293, 0.707, 0.0, -0.7003]",0,-0.7003,0.293,0.7070000000000001,0.0
2402,2402,2402,RT @BBCWorld: 🎶 I hear the drums echoing tonight 🎶 🎶 I hear the drums echoing tonight 🎶 🎶 I hear the drums echoing tonight 🎶 🎶 I hear the d…,rt bbcworld hear drum echo tonight hear drum echo tonight hear drum echo tonight hear,4,"[0.0, 1.0, 0.0, 0.0]",0,0.0,0.0,1.0,0.0
2403,2403,2403,United States ranked as one of the deadliest countries for journalists to work in,unit state rank one deadliest countri journalist work,4,"[0.0, 1.0, 0.0, 0.0]",0,0.0,0.0,1.0,0.0
2404,2404,2404,"A genetically modified Devil's vine, a type of ivy, reduced benzene levels by 1,750mg per cubic metre over eight da…",genet modifi devil vine type ivi reduc benzen level mg per cubic metr eight da,4,"[0.239, 0.761, 0.0, -0.6597]",0,-0.6597,0.239,0.7609999999999999,0.0
2405,2405,2405,Well isn't this interesting?,well interest,4,"[0.0, 0.0, 1.0, 0.6249]",1,0.6249,0.0,0.0,1.0
2406,2406,2406,Big alliances and mergers could shore up balance-sheets in the car industry. But such transactions are difficult to…,big allianc merger could shore balanc sheet car industri transact difficult,4,"[0.2, 0.8, 0.0, -0.3612]",0,-0.3612,0.2,0.8,0.0
2407,2407,2407,"The death of WokeCenter and the return of SportsCenter, we hope",death wokecent return sportscent hope,4,"[0.398, 0.306, 0.296, -0.25]",-1,-0.25,0.39799999999999996,0.306,0.29600000000000004
2408,2408,2408,"Many Twitter threads on #HimToo, the hashtag on false accusations, are posted by worried mothers of sons",mani twitter thread himtoo hashtag fals accus post worri mother son,4,"[0.0, 1.0, 0.0, 0.0]",0,0.0,0.0,1.0,0.0
2409,2409,2409,"Emerging markets were relieved by recent reassurances from Jerome Powell, the Fed's chairman",emerg market reliev recent reassur jerom powel fed chairman,4,"[0.0, 1.0, 0.0, 0.0]",0,0.0,0.0,1.0,0.0
2410,2410,2410,Trump to boy: Do you believe in Santa?,trump boy believ santa,4,"[0.0, 1.0, 0.0, 0.0]",0,0.0,0.0,1.0,0.0
2411,2411,2411,President Trump makes surprise Christmas visit to troops in Iraq,presid trump make surpris christma visit troop iraq,4,"[0.0, 1.0, 0.0, 0.0]",0,0.0,0.0,1.0,0.0
2412,2412,2412,UNiDAYS founder denies sexual harassment claims,uniday founder deni sexual harass claim,4,"[0.39, 0.61, 0.0, -0.4939]",0,-0.4939,0.39,0.61,0.0
2413,2413,2413,"Internet dating has many benefits, but not everyone in the virtual bar is treated as equal, as we wrote in one of o…",internet date mani benefit everyon virtual bar treat equal wrote one,4,"[0.0, 0.612, 0.388, 0.6908]",0,0.6908,0.0,0.612,0.38799999999999996
2414,2414,2414,"RT @bbcstories: ""I exposed racism at my university and got suspended for it’ - Chloe's speaking out for the first time since the incident.…",rt bbcstori expos racism univers got suspend chloe speak first time sinc incid,4,"[0.368, 0.632, 0.0, -0.7506]",0,-0.7506,0.368,0.632,0.0
2415,2415,2415,Audiences have been subjected to the same sort of thing for decades. Writers and directors might consider a differe…,audienc subject sort thing decad writer director might consid differ,4,"[0.0, 1.0, 0.0, 0.0]",0,0.0,0.0,1.0,0.0
2416,2416,2416,RT @BBCSport: 🏆 5x FA Cup 🏆 4x Premier League 🏆 3x League Cup 🏆 1x Champions League 🏆 1x Europa League What a career it has been for Petr…,rt bbcsport x fa cup x premier leagu x leagu cup x champion leagu x europa leagu career petr,4,"[0.0, 0.769, 0.231, 0.5994]",0,0.5994,0.0,0.769,0.231
2417,2417,2417,"Even though it has riled Vladimir Putin, some 60% of Russians say they are not bothered by the Ukrainian split",even though rile vladimir putin russian say bother ukrainian split,4,"[0.211, 0.789, 0.0, -0.34]",0,-0.34,0.21100000000000002,0.789,0.0
2418,2418,2418,"Since 1983 70,000 universities for the elderly have opened in China. In an explainer from August, we explore why th…",sinc univers elder open china explain august explor th,4,"[0.0, 1.0, 0.0, 0.0]",0,0.0,0.0,1.0,0.0
2419,2419,2419,"Poor monsoons, new taxes and high fuel prices have made the past few years grim for India's farmers",poor monsoon new tax high fuel price made past year grim india farmer,4,"[0.382, 0.618, 0.0, -0.7783]",0,-0.7783,0.382,0.618,0.0
2420,2420,2420,"RT @BBCWorld: ""It’s a kind of gymnastics on concrete"" Why parkour's leading lady Silke Sollfrank chose freerunning over Olympic dreams ht…",rt bbcworld kind gymnast concret parkour lead ladi silk sollfrank chose freerun olymp dream ht,4,"[0.0, 0.707, 0.293, 0.6597]",0,0.6597,0.0,0.7070000000000001,0.293
2421,2421,2421,Tim is smart. Be like Tim. Make sure you subscribe to “Something’s Off with Andrew Heaton” if you aren’t already!,tim smart like tim make sure subscrib someth andrew heaton alreadi,4,"[0.0, 0.516, 0.484, 0.7579]",0,0.7579,0.0,0.516,0.484
2422,2422,2422,Verbs are more likely to arouse emotions than nouns are. One of our most popular articles in 2018,verb like arous emot noun one popular articl,4,"[0.0, 0.531, 0.469, 0.6486]",0,0.6486,0.0,0.531,0.469
2423,2423,2423,Der Spiegel magazine considering criminal charges against star reporter who fabricated stories,der spiegel magazin consid crimin charg star report fabric stori,4,"[0.0, 1.0, 0.0, 0.0]",0,0.0,0.0,1.0,0.0
2424,2424,2424,Kit Harington: 'Ed Sheeran told me to live in Suffolk',kit harington ed sheeran told live suffolk,4,"[0.0, 1.0, 0.0, 0.0]",0,0.0,0.0,1.0,0.0
2425,2425,2425,The swatting of celebrities has been eclipsed by the swatting of gamers,swat celebr eclips swat gamer,4,"[0.0, 1.0, 0.0, 0.0]",0,0.0,0.0,1.0,0.0
2426,2426,2426,California’s biggest utility is in deep trouble,california biggest util deep troubl,4,"[0.0, 1.0, 0.0, 0.0]",0,0.0,0.0,1.0,0.0
2427,2427,2427,"Are you surprised by Kavanaugh, Roberts joining with SCOTUS liberals to refuse to hear Planned Parenthood funding appeal?",surpris kavanaugh robert join scotus liber refus hear plan parenthood fund appeal,4,"[0.0, 0.833, 0.167, 0.296]",0,0.29600000000000004,0.0,0.833,0.16699999999999998
2428,2428,2428,"New developments will make it simpler to seriously damage the marine environment, but could also help to save it. O…",new develop make simpler serious damag marin environ could also help save,4,"[0.08, 0.556, 0.364, 0.6808]",0,0.6808,0.08,0.556,0.364
2429,2429,2429,European workers may opt to stay in the EU rather than rely on the hospitality of the British government,european worker may opt stay eu rather reli hospit british govern,4,"[0.0, 1.0, 0.0, 0.0]",0,0.0,0.0,1.0,0.0
2430,2430,2430,"NOMAD is 20 times more sensitive than the Curiosity rover’s detector, and it has found no methane",nomad time sensit curios rover detector found methan,4,"[0.0, 1.0, 0.0, 0.0]",0,0.0,0.0,1.0,0.0
2431,2431,2431,Our analysis finds few managers who have beaten expectations for long enough to deserve proper credit. Diego Simeon…,analysi find manag beaten expect long enough deserv proper credit diego simeon,4,"[0.182, 0.649, 0.169, -0.0516]",0,-0.0516,0.182,0.649,0.16899999999999998
2432,2432,2432,"There is little sign of a surge towards switching banks, but progress is being made",littl sign surg toward switch bank progress made,4,"[0.0, 0.714, 0.286, 0.4215]",0,0.4215,0.0,0.7140000000000001,0.28600000000000003
2433,2433,2433,Democrat Kamala Harris announces presidential run,democrat kamala harri announc presidenti run,4,"[0.0, 1.0, 0.0, 0.0]",0,0.0,0.0,1.0,0.0
2434,2434,2434,The Kurds have proven to be invaluable allies in the fight against ISIS.,kurd proven invalu alli fight isi,4,"[0.342, 0.658, 0.0, -0.3818]",0,-0.3818,0.342,0.6579999999999999,0.0
2435,2435,2435,Eight of the European Union's northern states have resurrected a medieval alliance. The reason? Brexit…,eight european union northern state resurrect mediev allianc reason brexit,4,"[0.0, 1.0, 0.0, 0.0]",0,0.0,0.0,1.0,0.0
2436,2436,2436,"In 2019 it will add ""Dumbo"", ""Aladdin"" and ""The Lion King"" to its roster of ""live-action remakes"". The revamps are…",add dumbo aladdin lion king roster live action remak revamp,4,"[0.0, 1.0, 0.0, 0.0]",0,0.0,0.0,1.0,0.0
2437,2437,2437,"RT @BBCPolitics: UK PM Theresa May wins a vote of no confidence and says she's reaching out to other party leaders about #Brexit, starting…",rt bbcpolit uk pm theresa may win vote confid say reach parti leader brexit start,4,"[0.0, 0.726, 0.274, 0.5994]",0,0.5994,0.0,0.726,0.27399999999999997
2438,2438,2438,Ocasio-Cortez says she has Jewish heritage during Hanukkah event,ocasio cortez say jewish heritag hanukkah event,4,"[0.0, 1.0, 0.0, 0.0]",0,0.0,0.0,1.0,0.0
2439,2439,2439,“Nomophobia”—the fear of not having your mobile phone—is one of the least depressing selections made for 2018,nomophobia fear mobil phone one least depress select made,4,"[0.249, 0.546, 0.205, -0.1461]",0,-0.1461,0.249,0.546,0.205
2440,2440,2440,"RT @BBCPolitics: Jeremy Corbyn says Labour will table a motion of no confidence in the government ""at the moment we judge it to have the be…",rt bbcpolit jeremi corbyn say labour tabl motion confid govern moment judg,4,"[0.0, 1.0, 0.0, 0.0]",0,0.0,0.0,1.0,0.0
2441,2441,2441,Texas couple found guilty of forcing African girl to labor for years without pay,texa coupl found guilti forc african girl labor year without pay,4,"[0.0, 0.885, 0.115, 0.0762]",0,0.0762,0.0,0.885,0.115
2442,2442,2442,Remember when we were told Trump’s government shutdown would crash the market? 👀,rememb told trump govern shutdown would crash market,4,"[0.278, 0.722, 0.0, -0.4019]",0,-0.4019,0.278,0.722,0.0
2443,2443,2443,Protester held over Parliament incidents,protest held parliament incid,4,"[0.4, 0.6, 0.0, -0.25]",0,-0.25,0.4,0.6,0.0
2444,2444,2444,OneWeb plans to have 900 satellites in orbit by 2027. It wants to provide cheap internet connectivity everywhere,oneweb plan satellit orbit want provid cheap internet connect everywher,4,"[0.0, 0.874, 0.126, 0.0772]",0,0.0772,0.0,0.8740000000000001,0.126
2445,2445,2445,"RT @VictoriaLIVE: ""Hand yourself in"" The father of a woman who died in a speedboat crash appeals to her killer, who is currently on the ru…",rt victorial hand father woman die speedboat crash appeal killer current ru,4,"[0.493, 0.362, 0.145, -0.8271]",-1,-0.8271,0.493,0.36200000000000004,0.145
2446,2446,2446,What does it take to clean up a corrupt state?,take clean corrupt state,4,"[0.0, 0.526, 0.474, 0.4019]",0,0.4019,0.0,0.526,0.474
2447,2447,2447,The rise in American high-school graduation rates looks puffed-up,rise american high school graduat rate look puf,4,"[0.0, 1.0, 0.0, 0.0]",0,0.0,0.0,1.0,0.0
2448,2448,2448,"Mr Kuma still remembers his childhood shock as a bullet-train station rose out of the rice paddies in Yokoyama, nea…",mr kuma still rememb childhood shock bullet train station rose rice paddi yokoyama nea,4,"[0.167, 0.833, 0.0, -0.3818]",0,-0.3818,0.16699999999999998,0.833,0.0
2449,2449,2449,Christian Bale thanks Satan for Dick Cheney role inspiration — and the Church of Satan loves it,christian bale thank satan dick cheney role inspir church satan love,4,"[0.183, 0.444, 0.372, 0.5267]",0,0.5267,0.183,0.444,0.37200000000000005
2450,2450,2450,Can Theresa May bring her critics on board?,theresa may bring critic board,4,"[0.344, 0.656, 0.0, -0.2732]",0,-0.2732,0.344,0.6559999999999999,0.0
2451,2451,2451,Dyson announces it is moving UK head office to Singapore,dyson announc move uk head offic singapor,4,"[0.0, 1.0, 0.0, 0.0]",0,0.0,0.0,1.0,0.0
2452,2452,2452,He probably sends emojis,probabl send emoji,4,"[0.0, 1.0, 0.0, 0.0]",0,0.0,0.0,1.0,0.0
2453,2453,2453,Democratic politicians honor MLK weekend by calling President Trump racist,democrat politician honor mlk weekend call presid trump racist,4,"[0.282, 0.493, 0.225, -0.2023]",0,-0.2023,0.282,0.493,0.225
2454,2454,2454,The unlikeliest education revolution is taking place in Pakistan. This briefing was one of our most popular of 2018,unlikeliest educ revolut take place pakistan brief one popular,4,"[0.0, 0.741, 0.259, 0.4215]",0,0.4215,0.0,0.741,0.259
2455,2455,2455,"Migrants demand asylum or $50k from President Trump. After that, maybe he'll give every citizen a lifetime supply o…",migrant demand asylum k presid trump mayb give everi citizen lifetim suppli,4,"[0.13, 0.87, 0.0, -0.128]",0,-0.128,0.13,0.87,0.0
2456,2456,2456,Sign. Us. Up. 🙌🏻,sign u,4,"[0.0, 1.0, 0.0, 0.0]",0,0.0,0.0,1.0,0.0
2457,2457,2457,Preach,preach,4,"[0.0, 1.0, 0.0, 0.0]",0,0.0,0.0,1.0,0.0
2458,2458,2458,"Ocasio-Cortez schooled, hit with reality check after suggesting better ways to spend $5.7B",ocasio cortez school hit realiti check suggest better way spend b,4,"[0.0, 0.756, 0.244, 0.4404]",0,0.4404,0.0,0.7559999999999999,0.244
2459,2459,2459,"In an incredibly tough moment, he still chose to thank God",incred tough moment still chose thank god,4,"[0.149, 0.396, 0.455, 0.4767]",1,0.4767,0.149,0.396,0.455
2460,2460,2460,Wednesday’s Telegraph: “Raab: cut business tax with EU £39bn” via @AllieHBNews #bbcpapers #tomorrowspaperstoday,wednesday telegraph raab cut busi tax eu bn via alliehbnew bbcpaper tomorrowspaperstoday,4,"[0.16, 0.84, 0.0, -0.2732]",0,-0.2732,0.16,0.84,0.0
2461,2461,2461,How do you feel about this sign?,feel sign,4,"[0.0, 1.0, 0.0, 0.0]",0,0.0,0.0,1.0,0.0
2462,2462,2462,Russian security agency arrests 'US spy' in Moscow,russian secur agenc arrest u spi moscow,4,"[0.324, 0.676, 0.0, -0.34]",0,-0.34,0.324,0.6759999999999999,0.0
2463,2463,2463,Guide dogs: Where do they really come from?,guid dog realli come,4,"[0.0, 1.0, 0.0, 0.0]",0,0.0,0.0,1.0,0.0
2464,2464,2464,Well that's comforting,well comfort,4,"[0.0, 0.0, 1.0, 0.5574]",1,0.5574,0.0,0.0,1.0
2465,2465,2465,Goldman Sachs estimates that using AI could generate additional profits of $25bn over the next ten years. One of ou…,goldman sach estim use ai could generat addit profit bn next ten year one ou,4,"[0.0, 0.828, 0.172, 0.4404]",0,0.4404,0.0,0.828,0.172
2466,2466,2466,"RT @DannyShawBBC: BREAKING : Chief Constable of Cleveland Police, Mike Veale, is resigning from the force after less than a year in post,…",rt dannyshawbbc break chief constabl cleveland polic mike veal resign forc le year post,4,"[0.156, 0.844, 0.0, -0.34]",0,-0.34,0.156,0.8440000000000001,0.0
2467,2467,2467,Add a liver enzyme to a type of ivy to purify the air in buildings,add liver enzym type ivi purifi air build,4,"[0.0, 1.0, 0.0, 0.0]",0,0.0,0.0,1.0,0.0
2468,2468,2468,Freemasonry can appear incomprehensible because it contains no coherent ideology or doctrine. One of our most popul…,freemasonri appear incomprehens contain coher ideolog doctrin one popul,4,"[0.0, 1.0, 0.0, 0.0]",0,0.0,0.0,1.0,0.0
2469,2469,2469,"Only when ""data"" is understood to mean ""people"" will individuals demand accountability from those who seek to snoop…",data understood mean peopl individu demand account seek snoop,4,"[0.158, 0.842, 0.0, -0.128]",0,-0.128,0.158,0.8420000000000001,0.0
2470,2470,2470,A deadly explosion in Mexico punctures the optimism of a new era,dead explos mexico punctur optim new era,4,"[0.417, 0.583, 0.0, -0.6486]",0,-0.6486,0.41700000000000004,0.583,0.0
2471,2471,2471,A quarter of the world's population lives in countries that are not free. How do you bring down a dictator?,quarter world popul life countri free bring dictat,4,"[0.0, 0.68, 0.32, 0.5106]",0,0.5106,0.0,0.68,0.32
2472,2472,2472,RT @BBCScotlandNews: Thursday's Scottish front page review #Scotpapers,rt bbcscotlandnew thursday scottish front page review scotpap,4,"[0.0, 1.0, 0.0, 0.0]",0,0.0,0.0,1.0,0.0
2473,2473,2473,Donald Trump believed Jim Mattis and John Kelly would be ruthless executors of his will. He was mistaken,donald trump believ jim matti john kelli would ruthless executor mistaken,4,"[0.2, 0.8, 0.0, -0.3612]",0,-0.3612,0.2,0.8,0.0
2474,2474,2474,"RT @BBCPolitics: ""The prime minister's invitation to talks have been exposed as a PR sham"" Jeremy Corbyn says ""nothing has changed"" after…",rt bbcpolit prime minist invit talk expos pr sham jeremi corbyn say noth chang,4,"[0.0, 1.0, 0.0, 0.0]",0,0.0,0.0,1.0,0.0
2475,2475,2475,"Before Mueller, the FBI was investigating whether Trump was secretly working for Russia: NYT report",mueller fbi investig whether trump secret work russia nyt report,4,"[0.0, 1.0, 0.0, 0.0]",0,0.0,0.0,1.0,0.0
2476,2476,2476,"China detains more than 100 Christians, including prominent pastor, in overnight raids",china detain christian includ promin pastor overnight raid,4,"[0.286, 0.714, 0.0, -0.4215]",0,-0.4215,0.28600000000000003,0.7140000000000001,0.0
2477,2477,2477,Accuracy in reporting,accuraci report,4,"[0.0, 1.0, 0.0, 0.0]",0,0.0,0.0,1.0,0.0
2478,2478,2478,'Black Eye Friday' or 'Mad Friday': Is it time for the nickname to change?,black eye friday mad friday time nicknam chang,4,"[0.314, 0.686, 0.0, -0.4939]",0,-0.4939,0.314,0.6859999999999999,0.0
2479,2479,2479,"Brexit deal provides certainty, Gove to tell farmers",brexit deal provid certainti gove tell farmer,4,"[0.0, 1.0, 0.0, 0.0]",0,0.0,0.0,1.0,0.0
2480,2480,2480,China's 'Jack the Ripper' Gao Chengyong executed for murders,china jack ripper gao chengyong execut murder,4,"[0.439, 0.561, 0.0, -0.6908]",0,-0.6908,0.439,0.561,0.0
2481,2481,2481,Naomi Osaka: Noodle company apologises for 'white-washing',naomi osaka noodl compani apologis white wash,4,"[0.0, 1.0, 0.0, 0.0]",0,0.0,0.0,1.0,0.0
2482,2482,2482,Universities told to end 'spiralling' grade inflation,univers told end spiral grade inflat,4,"[0.0, 1.0, 0.0, 0.0]",0,0.0,0.0,1.0,0.0
2483,2483,2483,The story behind the 24th door of our Daily chart advent looks at the perils of social media,stori behind th door daili chart advent look peril social medium,4,"[0.213, 0.787, 0.0, -0.4019]",0,-0.4019,0.213,0.787,0.0
2484,2484,2484,King George VI Chase: Kempton big race - focus on runners and riders,king georg vi chase kempton big race focus runner rider,4,"[0.0, 1.0, 0.0, 0.0]",0,0.0,0.0,1.0,0.0
2485,2485,2485,"New features in the smartphone market now attract polite interest at best, and sometimes even jokes",new featur smartphon market attract polit interest best sometim even joke,4,"[0.0, 0.37, 0.63, 0.8979]",1,0.8979,0.0,0.37,0.63
2486,2486,2486,"RT @BBC_HaveYourSay: After the @YouTube 2018 Rewind video became the most disliked on the platform ever, content creators took it upon them…",rt bbc haveyoursay youtub rewind video becam dislik platform ever content creator took upon,4,"[0.0, 1.0, 0.0, 0.0]",0,0.0,0.0,1.0,0.0
2487,2487,2487,"Aw, come on. You only had like 4, maaaybe 5, scandals last month. Your party needs you! 😬",aw come like maaayb scandal last month parti need,4,"[0.234, 0.565, 0.202, -0.1027]",0,-0.1027,0.23399999999999999,0.565,0.20199999999999999
2488,2488,2488,Flashback video: When Biden backed Barr to be AG,flashback video biden back barr ag,4,"[0.0, 1.0, 0.0, 0.0]",0,0.0,0.0,1.0,0.0
2489,2489,2489,Sir Billy Connolly: 'I don't fear death',sir billi connolli fear death,4,"[0.703, 0.297, 0.0, -0.7964]",-1,-0.7964,0.703,0.297,0.0
2490,2490,2490,Syria conflict: Macron criticises Trump's withdrawal decision,syria conflict macron criticis trump withdraw decis,4,"[0.277, 0.723, 0.0, -0.3182]",0,-0.3182,0.27699999999999997,0.723,0.0
2491,2491,2491,Travel warning as millions begin Christmas getaway,travel warn million begin christma getaway,4,"[0.219, 0.781, 0.0, -0.1027]",0,-0.1027,0.21899999999999997,0.7809999999999999,0.0
2492,2492,2492,"Saving the rich is difficult, as Jesus once observed, but not impossible",save rich difficult jesus observ imposs,4,"[0.203, 0.244, 0.553, 0.6486]",1,0.6486,0.203,0.244,0.5529999999999999
2493,2493,2493,CNN anchor says she's 'most patriotic' when watching SNL criticize presidents — here's why,cnn anchor say patriot watch snl critic presid,4,"[0.231, 0.769, 0.0, -0.2732]",0,-0.2732,0.231,0.769,0.0
2494,2494,2494,No WAY it’s a coincidence. 🇺🇸,way coincid,4,"[0.0, 1.0, 0.0, 0.0]",0,0.0,0.0,1.0,0.0
2495,2495,2495,Kylie Minogue to play Glastonbury's legend slot,kyli minogu play glastonburi legend slot,4,"[0.0, 0.676, 0.324, 0.34]",0,0.34,0.0,0.6759999999999999,0.324
2496,2496,2496,"Homelessness: Thousands sleeping rough in cars, Crisis says",homeless thousand sleep rough car crisi say,4,"[0.0, 1.0, 0.0, 0.0]",0,0.0,0.0,1.0,0.0
2497,2497,2497,"In one of our most popular culture blogs this year, we argued that “The Walking Dead” needs to move in a new direct…",one popular cultur blog year argu walk dead need move new direct,4,"[0.251, 0.585, 0.164, -0.3612]",0,-0.3612,0.251,0.585,0.16399999999999998
2498,2498,2498,"Asylum claims by Saudis rose 318% from 2012 to 2017, according to the UN’s refugee agency",asylum claim saudi rose accord un refuge agenc,4,"[0.0, 1.0, 0.0, 0.0]",0,0.0,0.0,1.0,0.0
